mention_id,scan_date,brand_id,brand_name,product,source_name,source_type,domain,url,title,snippet,published_date,platform,is_first_party,is_partner_or_reseller,discovery_source,signal_score,sentiment
46467f0ca17c497d,2026-06-20T15:23:00Z,openai,OpenAI,OpenAI (general),inc.com,news_article,news.google.com,https://news.google.com/rss/articles/CBMiywFBVV95cUxNLUNwR0RNU2JHNEFMd1BJNEtQZkVRUzltUzhoR0RIRjZTUGc3bG9ENnp5S3dLQklEV2U3UXZQRXI0TGhNa3FxTm9KTnNqRG12N3FjZzdhVWlKUW1PWE5XLU5XYTNFVHlWUGJZTEQwRHN6N2lPdjNGZE5MUEEwOXpfc3RnSEJyVGw5dzg4VVRQMXVmVXlmTFBzc3RCelNPMzZKY3dCTHNidnM3bjVwN1ZveDdjaUsxVG15V0FKZ01pYzA1Wm83UGNfWTRFWQ?oc=5,The Most Important AI Company Isn't OpenAI. It Might Just Be This Under-the-Radar Business,The Most Important AI Company Isn't OpenAI. It Might Just Be This Under-the-Radar Business  inc.com,2026-06-20,web,False,False,google_news_rss,45,neutral
5455bee80c3fd624,2026-06-20T15:23:00Z,openai,OpenAI,OpenAI (general),thestreet.com,news_article,news.google.com,https://news.google.com/rss/articles/CBMinAFBVV95cUxOSXUwUmZBYzl1U0M5ZngtSXkwQUVuRFVuSldiNjhlVnU1d1dOUmQ4RUhPMFBPVVF3bVdCaVBLWk5mcWkwc2JXNTRIMDRDR1dJeGZUTTR1OXZnSEF4akRqeklPb2xaSS1OeVFJQmt6VlNxa01aSGZsVzdmZmZVY1ZrQjNhUUlod3BOcTA3OE9WWlNIM0V6anlnWk5OYko?oc=5,OpenAI admits enterprises need better control over AI costs,OpenAI admits enterprises need better control over AI costs  thestreet.com,2026-06-20,web,False,False,google_news_rss,45,neutral
4d1ea13e3bcf51f7,2026-06-20T15:23:00Z,openai,OpenAI,OpenAI (general),observer.com,news_article,news.google.com,https://news.google.com/rss/articles/CBMifEFVX3lxTFBMWDZxdF96Rm84S2ZNd3BNQ1FjUmlnYndpLXYybUV2dTJSR05FOTAwc3lfTXpEYzdZMW9rTTVhbi0xY01MMl81S2p0TEV3WDJnOHZkc0FwQ0Z1Qnd6YzBYbzBVd2RlRkNFMXRBTzRhYTVuUFZJaDNxOFgxZEE?oc=5,"As OpenAI and Anthropic Race Toward IPOs, Trust Becomes the Real Product","As OpenAI and Anthropic Race Toward IPOs, Trust Becomes the Real Product  observer.com",2026-06-19,web,False,False,google_news_rss,45,neutral
1d1731d9af1b9b9f,2026-06-20T15:23:00Z,openai,OpenAI,OpenAI (general),The Decoder,news_article,news.google.com,https://news.google.com/rss/articles/CBMimgFBVV95cUxONk83bVVwM0ZtdndYdk00V1JydHpkcmxuc2toQVBxazgwenlWQnJobHRtaGc4a3RaX3Y0azRTcURZQ2UxbGliQk9pN0hEempqUGt0dUxRT2llMlR0dVZkQTB6RzRFcUpmV2xWTk9aVW9iOVpJdkZzczByTlljQXF4cjR5Nks0RHRyZElKUEhrb1NGNHFkeHFZTzR3?oc=5,OpenAI's Codex can now watch you work once and repeat the task forever,OpenAI's Codex can now watch you work once and repeat the task forever  The Decoder,2026-06-20,web,False,False,google_news_rss,45,neutral
24999df63b3cf233,2026-06-20T15:23:00Z,openai,OpenAI,OpenAI (general),PCMag,news_article,news.google.com,https://news.google.com/rss/articles/CBMifkFVX3lxTE0tWjBHU1FRSmg5WjhNd0dFXzZsRUFVWG5CdEVHbjRxRy13WkQwZl9NRDBsVHE3emZOSUhIVnVHNXEwYl9tNGZwZjEwZVl2QUphQy1MZjFDRE8xRXBFYTA2X19icnlqazR1RENIWlB3QmQzdVpFbW9HSzJ5MS1zQQ?oc=5,Amazon MGM Studios Dumps Upcoming OpenAI Movie,Amazon MGM Studios Dumps Upcoming OpenAI Movie  PCMag,2026-06-20,web,False,False,google_news_rss,45,neutral
5fb940d14a84bd45,2026-06-20T15:23:07Z,openai,OpenAI,OpenAI (general),OpenAI,news_article,news.google.com,https://news.google.com/rss/articles/CBMiT0FVX3lxTE9yZVdQeFFPblJzRDk5ZFBraThGYUVvZllNc1poX2M5OUxVWDMzNlY2MUlVT1k1SVh3VFBHYVFQR1dBYTlOTVQxWU8zVjl0UGc?oc=5,How Preply combines AI and human tutors to personalize learning,How Preply combines AI and human tutors to personalize learning  OpenAI,2026-06-19,web,False,False,google_news_rss,45,neutral
0056213bcae70bd8,2026-06-20T15:23:33Z,github,GitHub,GitHub Actions,The GitHub Blog,news_article,news.google.com,https://news.google.com/rss/articles/CBMioAFBVV95cUxNUGNINXAwNHpvM25IM19XRnhxYVE4RXI2X0xFOW15Ny1YT0o2RTRCeWpYd0x0WnpRSjU3Ti1ZWnhtWmE4NEdTeW9FSncwcUlQS3ZyTnhmVHVNLVRnc190ODU1cFBfdllKOWZYUU5hcU9kMVRua3d0T0VjUkNZU2h6ZnY2cUhFb0JSZ3V2bGp6V3VJYkM0dGZ5czBWZWhCaEdE?oc=5,GitHub Actions concurrency groups now allow larger queues,GitHub Actions concurrency groups now allow larger queues  The GitHub Blog,2026-05-07,web,False,False,google_news_rss,45,neutral
26567bde6e1916ff,2026-06-20T15:23:58Z,vercel,Vercel,Vercel (general),Blackmagic Design,news_article,news.google.com,https://news.google.com/rss/articles/CBMiakFVX3lxTE5jZEc3Wkx4Q0xZMVdGVlZHcXB5bTd1Z3VCWVFaZkZvY0NUamVtUXY1dmlhYjV0UFlQRllWQUdHS3ZTNFpERTJFZ0RfUlpua3M0QUk4VTRlSjlNdmFsNkNqU3MyQWpBaDFEQmc?oc=5,Dreamtek Uses Full Blackmagic Workflow for Vercel Next JS Event,Dreamtek Uses Full Blackmagic Workflow for Vercel Next JS Event  Blackmagic Design,2026-06-20,web,False,False,google_news_rss,45,neutral
25caaac86f9a808d,2026-06-20T15:23:07Z,openai,OpenAI,OpenAI (general),OpenAI,news_article,news.google.com,https://news.google.com/rss/articles/CBMiaEFVX3lxTFBTMkFjWW5KZGUwZEE1VlhUMy1uLWY2UEt1R29QVXJDdi02d3hwY2c3UTBTa2UxZTZDQkZBbFhHQVB2cWt0OVhpZk9LNzlYMXRMLTRBZzZ5dHVuZ2FQOGZxS2U1RzRRSE5w?oc=5,Our response to the Axios developer tool compromise,Our response to the Axios developer tool compromise  OpenAI,2026-04-10,web,False,False,google_news_rss,35,neutral
cbe83516b7e24d77,2026-06-21T15:28:43Z,openai,OpenAI,ChatGPT,WIRED,news_article,news.google.com,https://news.google.com/rss/articles/CBMiiwFBVV95cUxObVVCVFRuMDhKRndQRENyNTFSTEFiOXltMjlsZVd1RElwdGJZWWR4R2puQU5kbENESmdaRnhoRnFfRzdicmhORlA0Nm5nUlJDZnZ1V3g3V2lhbDJxTVllNUwwZUpqeXZHS1ZaeExIZE91WGpuYk1xdi15TDBlSngwbDlOMV9iSEp6UWxZ?oc=5,28 Tips to Take Your ChatGPT Prompts to the Next Level,28 Tips to Take Your ChatGPT Prompts to the Next Level  WIRED,2026-06-21,web,False,False,google_news_rss,55,neutral
a926744770032138,2026-06-21T15:28:43Z,openai,OpenAI,ChatGPT,Financial Times,news_article,news.google.com,https://news.google.com/rss/articles/CBMihAFBVV95cUxOWEROVjBLZHlmRElXVkM5NHVsT0U1WHZUMlN2azlDMlhsVFVfMjE3dm12SGZHcjVPVGlRclpYOVFMbV9NeDd4WDJTRjA0bXEtVjgzekhvTFRyaURVSjJwSTB1dmhPU09Qb2VTdFNXc014ZnEyZVR2WjgyYlZJQmdKMENQejA?oc=5,ChatGPT moved my cheese: AI is unsettling the self-help shelf,ChatGPT moved my cheese: AI is unsettling the self-help shelf  Financial Times,2026-06-20,web,False,False,google_news_rss,55,neutral
f8909f2045082302,2026-06-21T15:28:43Z,openai,OpenAI,ChatGPT,Tom's Guide,news_article,news.google.com,https://news.google.com/rss/articles/CBMi2gFBVV95cUxOUHdUdmN2SV9YRkZOekl3d0xxSmR5NGYwYlJGZVFSWVBBeThtM0xJVjQ3anR4ZlZuWDhWdkhMRnMxNFdMTm52SE1DSFpnOGRacG1ZOV9zNDJWWHNTTVA5LVVWQWtOaUd5SE5rVk9uWTB2dUwySmhoUDFlLWdITHJpWnRFNUlYUExvQzY1MkQzVTI2eFlZZmFsd20yTXRXM0UyNXViZjVvSWZLU25NZFpsemtKdzJES2NJNGEyb2UtbUFyVy1GZlhjWlJwZlViVjhIaHdjZW05ekhJUQ?oc=5,I asked ChatGPT and Claude to plan my next dream trip to Japan with Viator — one delivered much better destinations,I asked ChatGPT and Claude to plan my next dream trip to Japan with Viator — one delivered much better destinations  Tom's Guide,2026-06-21,web,False,False,google_news_rss,55,neutral
e6856aa66dbf755d,2026-06-21T15:28:43Z,openai,OpenAI,ChatGPT,Macworld,news_article,news.google.com,https://news.google.com/rss/articles/CBMiwAFBVV95cUxOZ0JFbjY0bnRabFhOR1VTbW5lSWQteFhqZU9NM05aZmYyeWNDOGc0Nzh2VW5EOXZLMXhlYWdKX0RYVmYzZEM1cC04TWFIN1d1VFJiWFYtVi1tLTZQdXlMWV9xLS1WRWttS0kxOThnX1FYdm9QdC1WeHNlbnlKMVV4TlIwRl9KVWRmM3N6c2hwWnBMOTFVU1FTbXQ0YUFMM1hkeG9VcFEybVZXVTVxWVpFS3puNjZTNzRaYkFDbHBrZDk?oc=5,"A lifetime of ChatGPT, Claude & Gemini in one place for just $70 during Deal Days","A lifetime of ChatGPT, Claude & Gemini in one place for just $70 during Deal Days  Macworld",2026-06-21,web,False,False,google_news_rss,55,neutral
c91a7c6a820edab5,2026-06-21T15:28:43Z,openai,OpenAI,ChatGPT,Yahoo Finance,news_article,news.google.com,https://news.google.com/rss/articles/CBMiogFBVV95cUxORUZHZkxfTVpGeHhPMngxV01jVGltRDY0RHFGX1ZyZk5QV3VlSlVBa1d2cHFNYWdybmgtVVVBd0x6RkxMLUlwajR5VmRaUHl6QW5hbGZCcW1oUlFFaHJfdTNIRXkyaEtOSjRhZWc2bEdyRG5haV9fS1B3N3VPRmpBdkIxQXVFdl9fd0hRQzNhS3pGRXVjeGlwNjB0TUxyazk4WXc?oc=5,Michael Saylor Admits To Using ChatGPT To Build Strategy — We Asked AI If STRC Can Recover,Michael Saylor Admits To Using ChatGPT To Build Strategy — We Asked AI If STRC Can Recover  Yahoo Finance,2026-06-19,web,False,False,google_news_rss,55,neutral
36ee0637d2d6a60e,2026-06-21T15:28:43Z,openai,OpenAI,ChatGPT,PCMag,news_article,news.google.com,https://news.google.com/rss/articles/CBMinwFBVV95cUxPV2ppVTgybFN2cnh2Tl9ubUNnN1cwbHhCOUdEQWJnMUFVUjM2SGRmU2lwWEpXSzdLeUxYNENZb0tlc0NuSDBGT3FUaWRiaXRiR2o2RFduS3dXUzQ2OXZMbXhiSk4wQ0tyR2tuZ2FfQW1tNFVGV0VRSzlXeTJmLTR0U19zRFNGWTJSaTNHOFdVWHpDdzk0TmVaU2Z5RkZlZFE?oc=5,"This AI Tool Puts ChatGPT, Claude, and Gemini Under One Roof for Only $55","This AI Tool Puts ChatGPT, Claude, and Gemini Under One Roof for Only $55  PCMag",2026-06-21,web,False,False,google_news_rss,55,neutral
ac5731978b6e19b8,2026-06-21T15:28:46Z,openai,OpenAI,OpenAI (general),OpenAI,news_article,news.google.com,https://news.google.com/rss/articles/CBMiekFVX3lxTE9rS2hQOTJxQVVSQUIyYVl2VUp5ZDVOY0Jsc2Z6LS02TDFoWWNfQ2VUM2VYUDVZdG9zanBhQ2RONEFtcE9UWjhaQ0FSaG93NWttaGhUa0xWSkppMDV4TlltdV9YVkZ6LTVZWXlGem1UOVN2TVdGU0xLVm5R?oc=5,Supporting Europe’s work in ensuring a trustworthy AI ecosystem,Supporting Europe’s work in ensuring a trustworthy AI ecosystem  OpenAI,2026-06-20,web,False,False,google_news_rss,55,positive
89853fe65ed6e805,2026-06-21T15:29:25Z,github,GitHub,GitHub (general),The GitHub Blog,news_article,news.google.com,https://news.google.com/rss/articles/CBMirAFBVV95cUxQMzViZGtESXJ2NFE2Tmh0YUd5bUNhUkVuek1UYlFxVnlnTmxPaVJRREc0TFI5U0VGWXp0NjJlLVdUczNubnFZRUFwNE80RTVld2R1OWdYVG9tMkk3UEJZTU43VF9SVG5mOVlmSWhDWVlXeG0tX1o4RXJleUlFS1d6OHFZVVV3OW1lRDJEU0ZEd2llTGF4LS1VNVVKNm40RWNSdWxBQzVFSkl3OTRv?oc=5,Detecting Duplicate Issues – Public Preview and issue fields MCP support for GitHub Issues,Detecting Duplicate Issues – Public Preview and issue fields MCP support for GitHub Issues  The GitHub Blog,2026-06-18,web,False,False,google_news_rss,50,negative
e277cf26467c16cb,2026-06-21T15:28:39Z,openai,OpenAI,OpenAI (general),Variety,news_article,news.google.com,https://news.google.com/rss/articles/CBMiqwFBVV95cUxPMVBqY24tSVdzQ2lUaVRNRnIwcHZ0SXprTVZOem9hQ1hCZUlvRF9CUXVrcUpoS0lMZG5ZOFFUdGczY1lzVTZ3N3ZwZ3FENnJ1R21WNlVnZHhMdUFhVnplN3dBekRRWEIzZXJ6VXBucDNiX2NDU3hBTW9kR1dxakZ5cTJ6WFJIZDRZWnI0Qmg2N2RabGVXalZlaXA2U2M4M1U2MXE3eTl0bWNjOW8?oc=5,Luca Guadagnino’s Nearly Finished Sam Altman Movie ‘Artificial’ Dropped by Amazon After OpenAI Partnership,Luca Guadagnino’s Nearly Finished Sam Altman Movie ‘Artificial’ Dropped by Amazon After OpenAI Partnership  Variety,2026-06-19,web,False,False,google_news_rss,45,neutral
a8675a276b0e86a5,2026-06-21T15:28:39Z,openai,OpenAI,OpenAI (general),The New York Times,news_article,news.google.com,https://news.google.com/rss/articles/CBMinAFBVV95cUxQVHVqUGx6QXVMU0VqSW1qc3d4Yy1JbVBYNzBSbkE4SjEyWVZzNVZucXV5bERVeTY0d2VHQXNxckY5V3dQb01WSG51MDFfS0VTc0hGWE5OS1hDR3JicUpXZWJSeHgwNU1oRmNraUQ4R1pqSlZOdm5lZ1VTTkpWZThjU0EyNVdBNU9uNF9Sc2pOdDlqN2EzU2tqakJPY2w?oc=5,Amazon’s Movie Arm Abandons Film About OpenAI,Amazon’s Movie Arm Abandons Film About OpenAI  The New York Times,2026-06-20,web,False,False,google_news_rss,45,neutral
74d8a49df0414d56,2026-06-21T15:28:39Z,openai,OpenAI,OpenAI (general),The Information,news_article,news.google.com,https://news.google.com/rss/articles/CBMijgFBVV95cUxOZjFKUWliWk16ZVd0Qm5sLVNydTE2aG5qLVJ1Z25STzYtUzlSYjd3XzhlOU9LMlBsWXhGR3c5a1NGdHEzQ1R3REJaTDJlNWVzN2wtTUZHdzRJdXl4T2ZtOFltMWlBcmtmX2ZMMVM4THVNcHFtNjRIcFR2Vm45WVR5QkRYdXpxQXZvQ1VGcWxR?oc=5,"SpaceX’s 74-Day IPO Sets Pace for OpenAI, Anthropic","SpaceX’s 74-Day IPO Sets Pace for OpenAI, Anthropic  The Information",2026-06-21,web,False,False,google_news_rss,45,neutral
80e7bd9ac0b7a56f,2026-06-21T15:28:39Z,openai,OpenAI,OpenAI (general),Medium,news_article,news.google.com,https://news.google.com/rss/articles/CBMiowFBVV95cUxQeVVSZGVDWjFfVmVzQjVrSG1zN1pKbVpzTEUwZ0xUdHBhWUM2WlpnZ0NUaTV3UXNwMDNacmRCV3BELUpSVnM5dy1PSE9JcENqMUt2eXN4REI4SF9aT3pydzZ4V0pVQ2tTVEpnb2pCelBXOW1JRTZiWVFSalFSNWNmaGtwaGUwWHNfYmZsbTFXandnSFo5MGc2QVI0YkVXdGxkdFdj?oc=5,OpenAI Is In A Far Worse Position Than Anyone Thought It Was,OpenAI Is In A Far Worse Position Than Anyone Thought It Was  Medium,2026-06-18,web,False,False,google_news_rss,45,neutral
ae232a9220a30921,2026-06-21T15:28:39Z,openai,OpenAI,OpenAI (general),Yahoo Finance,news_article,news.google.com,https://news.google.com/rss/articles/CBMioAFBVV95cUxNYXEyc3Jpb3FtVnNnVF9Nem12WlJqU3hWYjdOeUlWY3kwMFd6Y1I0TTJ2aXpLVGxVQ0hWLWtvS0FUY3UtNkp1NloyX2o2MGNkNmh1MUJyY1FmT25RSnVRbk5Cc2l0c3o1NHpjczJNLWRnRjhKMTVSM3hoUzdNUkN1UTQxV2JGMkJLa0VHb2l1bUEtN1V4aV82eC00VWlDQlhL?oc=5,"Broadcom Builds Custom Chips for Google, Meta, Anthropic, and OpenAI. At 25 Times Forward Earnings, It's the Cheapest Mega-Cap AI Stock Nobody Talks About.","Broadcom Builds Custom Chips for Google, Meta, Anthropic, and OpenAI. At 25 Times Forward Earnings, It's the Cheapest Mega-Cap AI Stock Nobody Talks About.  Yahoo Finance",2026-06-19,web,False,False,google_news_rss,45,neutral
6799a44d0c46281a,2026-06-21T15:28:39Z,openai,OpenAI,OpenAI (general),Seeking Alpha,news_article,news.google.com,https://news.google.com/rss/articles/CBMikgFBVV95cUxQaWVoNkNvTVUtTDdxVG5NYnd6dzE4cmlVLTVRUXFBX1pFV1JuRVQwcUVITTNlenZZbTRubTNqQUl1QldxU05oYmJsZTRtUXM1TG9CQ3drUjFTRERGcWRlQVVfR1VhRXNGb2FET2puUV9LRHB1UDc1cDRhUjZJUkROSHBuNW1Yal9fdUtWcEpOTHlvdw?oc=5,SA Asks: What are the most attractive upcoming IPOs? (OPENAI:Private),SA Asks: What are the most attractive upcoming IPOs? (OPENAI:Private)  Seeking Alpha,2026-06-20,web,False,False,google_news_rss,45,neutral
39b2faa74c3ba5cb,2026-06-21T15:28:39Z,openai,OpenAI,OpenAI (general),24/7 Wall St.,news_article,news.google.com,https://news.google.com/rss/articles/CBMikgFBVV95cUxQUXc5b3hCNFhLVGt5U2p0ZVBEdGtUVjcwMjkxX1NiMllzWFNTMUU2eG5ncUJ6bVJZU29iMXM2dC1OQXhxU0NNc0c5dk5yR3czZ3lhX3ZGMWVpMjl1TlRCTHVXamk3c2NMTzBGYmJhLVBhbm9rem5maXdRTHVvbFZnVXlBSFFJRFRPRFFnVG9jWVFpQQ?oc=5,"Don’t Trust OpenAI, “This Is Your Final Warning”","Don’t Trust OpenAI, “This Is Your Final Warning”  24/7 Wall St.",2026-06-21,web,False,False,google_news_rss,45,neutral
4dc2105a9eef491d,2026-06-21T15:28:39Z,openai,OpenAI,OpenAI (general),Yahoo Finance,news_article,news.google.com,https://news.google.com/rss/articles/CBMipwFBVV95cUxPVWlsb2VfeTZGekxwWEhGNm5TNUl6ZS1SVlBVLVdnWm5Dck5yRlFpYXVHdmVXN3N6RWVaZW1pLUF1TGdTNE1nUThRS3lLQ2ZlYTVZTWgweDBVSmk5WW9uajVTQ3B6cUtzTVpvVlZkM0pjUlNWTGlWa1h2NnppRmdkdWJyYzFlRW9QTEk2S3UxcUlIRXk0elE2UnQ5a29vcHd6eVNKUFFNRQ?oc=5,"OpenAI, Anthropic Poach Approximately 100 Salesforce Employees This Year","OpenAI, Anthropic Poach Approximately 100 Salesforce Employees This Year  Yahoo Finance",2026-06-21,web,False,False,google_news_rss,45,neutral
5b57ae980b770266,2026-06-21T15:28:39Z,openai,OpenAI,OpenAI (general),The Motley Fool,news_article,news.google.com,https://news.google.com/rss/articles/CBMimAFBVV95cUxQZm5FTHVHZGZHSXhNUjB4c25vMFZJdGRrOWdrbWR1cTRuZlctdEw3Z21BYzgzRk5hUnpqLTNaSW1pb1kycGZ0YzBxOFFmQTRLQVF3a3Rrdms4dTJtdW96Vll6d01PSkVMUlQzME1aZkc4OGtNSUFNVGd3eFFmQjdXTGtVMWM0MVAxemx2RDdDejJLSjJ6ZWJ1Vg?oc=5,OpenAI's Massive Losses Strengthen the Bull Case for These 2 Artificial Intelligence (AI) Stocks,OpenAI's Massive Losses Strengthen the Bull Case for These 2 Artificial Intelligence (AI) Stocks  The Motley Fool,2026-06-21,web,False,False,google_news_rss,45,neutral
b6504268dd1c19d3,2026-06-21T15:28:39Z,openai,OpenAI,OpenAI (general),Forbes,news_article,news.google.com,https://news.google.com/rss/articles/CBMiswFBVV95cUxQbVZrVFBvdDV6RkhJSjF5Q0RnSmpCOEU4QjFEelhKbFpNRGpEaGRKUU50Qm1meXhUUlUwdXYtdS1ScTJBd0V1anpJSldxODczM2tvOV9XVWxob1E1Y2Y3bkJSa3JOQ3Yyd2tOQVZQdmc3NUhUdGlOd3NzNnVickNHdmx6YWFFdlFFSWhybHM3VVNjcUxhVlhnbzFBT0lyOVVSVXJ4M2hidWNsX3RsaHBqLVdlRQ?oc=5,'AGI Is Too Important'—Ben Goertzel's Crypto Bet Against OpenAI,'AGI Is Too Important'—Ben Goertzel's Crypto Bet Against OpenAI  Forbes,2026-06-21,web,False,False,google_news_rss,45,neutral
ab6c262284b87e9e,2026-06-21T15:28:46Z,openai,OpenAI,OpenAI (general),Crypto Briefing,news_article,news.google.com,https://news.google.com/rss/articles/CBMid0FVX3lxTE0zUjdXam9aMWZ4MDVkRS1TYTllQ0VZRTh5TG9TekxyWUpBWjdMVU9jTjdSRml2bk1jRUtvaGZ5VC1NQXczdmFZNjFsUE8yTzFlR21jY0FObWdUemdncUVsZjBvV1dmdU5YTWRKeThmaFJwNEt2S1VJ?oc=5,OpenAI partners with Open Network Lab for Kyoto startup pitch contest offering $1M in API credits,OpenAI partners with Open Network Lab for Kyoto startup pitch contest offering $1M in API credits  Crypto Briefing,2026-06-20,web,False,False,google_news_rss,45,neutral
2f0245c34f6b3b60,2026-06-21T15:28:46Z,openai,OpenAI,OpenAI (general),OpenAI,news_article,news.google.com,https://news.google.com/rss/articles/CBMiT0FVX3lxTFB1WWlQS2k0cGlxbTFZRzk1UDBmRW1od3BkeGZvT2hLWUhqblY1T0xGV3pJbWZpZW5TZXhhN0pSdHBBai1FVVctX3M4Y25nT00?oc=5,How Preply combines AI and human tutors to personalize learning,How Preply combines AI and human tutors to personalize learning  OpenAI,2026-06-19,web,False,False,google_news_rss,45,neutral
286d79e4b1c9d2b8,2026-06-21T15:29:53Z,github,GitHub,GitHub (general),Hacker News,news_article,neuviemeporte.github.io,https://neuviemeporte.github.io/f15-se2/2026/06/20/needyou.html,"DOS Game ""F-15 Strike Eagle II"" reversing project needs DOS test pilots","Article URL: https://neuviemeporte.github.io/f15-se2/2026/06/20/needyou.html
Comments URL: https://news.ycombinator.com/item?id=48609766
Points: 267
# Comments: 69",2026-06-20,web,False,False,known_rss,45,neutral
16dc032da6827eda,2026-06-21T15:29:53Z,vercel,Vercel,Vercel (general),Crypto Briefing,news_article,news.google.com,https://news.google.com/rss/articles/CBMiZ0FVX3lxTFBPdjBKZ29PX2xTbi1mcHJLRXE1MnBkZTY1NUtYUEJYQ2gzOVJDeHVXbkFCcV9VdDlXYU45elhNbl8wdC1ld1F6ZGdDR1VQSU9kbTFXajB6dlNaa3ZCZ3RqUzF3VnRRNXc?oc=5,Vercel CEO impressed by Z.AI’s GLM-5.2 coding capabilities,Vercel CEO impressed by Z.AI’s GLM-5.2 coding capabilities  Crypto Briefing,2026-06-21,web,False,False,google_news_rss,45,neutral
f030e5e174ac66f2,2026-06-21T15:29:53Z,vercel,Vercel,Vercel (general),ecommercenews.com.au,news_article,news.google.com,https://news.google.com/rss/articles/CBMikgFBVV95cUxNSFp2X3k3a0R2Nk5sSERTVXJka294UDVuVXRZMk9WMXRsOGhGUDM2UmFjeS1mTjBtNF9jNnRRYW1BTWhvclBOMUNtcWpzVTZFZkdsRlFrb1ZNZ29CNW51b05nbzhIVnA4YWdVSTNpMjRxU0ZpMGxvWHFoMUJZR3JkZzRVQ2VOR29Va3hYYV9hd3dEZw?oc=5,Vercel unveils agent tools as deployments turn AI-led,Vercel unveils agent tools as deployments turn AI-led  ecommercenews.com.au,2026-06-19,web,False,False,google_news_rss,45,neutral
73d4db3aa46f9de1,2026-06-21T15:29:53Z,vercel,Vercel,Vercel (general),HackerNoon,news_article,news.google.com,https://news.google.com/rss/articles/CBMifEFVX3lxTE9RWXd0d3dpejA5RTZZM20tajMtQjBjSWxxWTlMdXhWWG1lcEFuT2ZXN21LbjdUNXk2NzRLd3ZHQVVoaDg1V1V6NDBaLVpIRnVwSjZmZTFzX0F6RjNfNGtINVpWeVlTMHdHWnZzMmtVaTZoOTB2TnA2ZFVlRHE?oc=5,Vercel’s Zero Wants Compilers to Talk to AI Agents,Vercel’s Zero Wants Compilers to Talk to AI Agents  HackerNoon,2026-05-18,web,False,False,google_news_rss,35,neutral
f1197acc18f338c8,2026-06-22T18:05:40Z,openai,OpenAI,OpenAI (general),The Hollywood Reporter,news_article,news.google.com,https://news.google.com/rss/articles/CBMivwFBVV95cUxPMmVrNnZGdU5tdGtyTWFPVnlBbVVfM2hCU2tCZHU2cGRjZmNFWTVKYjAwdW1LV0N6VDdSMkhYZ1JUeUk3aGNTbURWZTFIeDNXV2QzNmZuZDZlMVVvWVJXbmZMT3FwdzVPWVgzY293OURrQmtjNFN2Tmc4UEZIM3NmU2wwYkxla3JvSEJqamlucV82YjVHNTFNdWlZVktYeDlpMVp1YVVtdGJWT014ajkwb0ZjZU5vRlM4NDBsRzVwUQ?oc=5,"Netflix, Focus Pass on Luca Guadagnino’s ‘Artificial’ After Amazon MGM Studios Dropped Sam Altman-OpenAI Movie","Netflix, Focus Pass on Luca Guadagnino’s ‘Artificial’ After Amazon MGM Studios Dropped Sam Altman-OpenAI Movie  The Hollywood ReporterAmazon dropped Luca Guadagnino's OpenAI film, months after partnering with OpenAI  MashableIt's hard not to see Jeff Bezos’s fingerprints on Amazon MGM's decision to dump Luca Guadagnino's OpenAI film  LaineyGossip",2026-06-21,web,False,False,google_news_rss,60,neutral
11ad5b60584036dc,2026-06-22T18:05:40Z,openai,OpenAI,OpenAI (general),Yahoo Finance,news_article,news.google.com,https://news.google.com/rss/articles/CBMikgFBVV95cUxQNGpRM1ZvN2dtOW5lVF9xS3lYZTZmZ3RZTWFxTEZYeGVHUFZZWm9TMVRtTXBQN1VjLWxYenhKbFZsbHVLMmtmZUJhNVdVa1RCUzh4SWctVy02SzdtQ0pmeU52dUtOemxVQkJWeDhfLU9ZZ241aG5kSDlMejZFcFlQT0FtZXFTT0VFdXRRR0JMNWt4UQ?oc=5,"Best IPO Stock to Buy and Hold: SpaceX, Anthropic, or OpenAI?","Best IPO Stock to Buy and Hold: SpaceX, Anthropic, or OpenAI?  Yahoo Finance",2026-06-22,web,False,False,google_news_rss,55,positive
d574b9956c74a127,2026-06-22T18:05:40Z,openai,OpenAI,ChatGPT,OpenAI,news_article,news.google.com,https://news.google.com/rss/articles/CBMiekFVX3lxTE90VVluclVyOVNEY3I2a2hVMzg0Ylp1VFhXa1pIdHlCd19wRUI4Z1pZZUktTUxZZnlPMjJ3YXZiRWswRzdBZENMRW02WFRYYTRRV1NxLUtwZjl0djc2dFhOZm5QdTJERUl6Q2N2eTFsQ1BfLTNXWlNwR3ZR?oc=5,Samsung Electronics brings ChatGPT and Codex to employees,Samsung Electronics brings ChatGPT and Codex to employees  OpenAI,2026-06-21,web,False,False,google_news_rss,55,neutral
24e9757d7f59dca8,2026-06-22T18:05:43Z,openai,OpenAI,ChatGPT,Engadget,news_article,news.google.com,https://news.google.com/rss/articles/CBMinAFBVV95cUxOWS1TQjhpVmowdmNSWHFaLVdaQmZEUnowUmNiNG16dUJQT2dEYmVpRWVKM0NnSzZJLUhiMUwwY2ZkLUZMclQtanFIZGVTSG84Q0x5Tjg0UjNnSHFQLWFnUWcwSFRjd18zS1FqdVlZdDhDLWtIZFRDNEtzY3lBZ0xwLUNxZlNGRGlPWi1yRzNRZmtWb0RWVU95a25rVmo?oc=5,OpenAI Signs Deal To Show Getty's Images In ChatGPT Results,OpenAI Signs Deal To Show Getty's Images In ChatGPT Results  Engadget,2026-06-22,web,False,False,google_news_rss,55,neutral
88658892dbc2bcbe,2026-06-22T18:05:43Z,openai,OpenAI,ChatGPT,ZDNET,news_article,news.google.com,https://news.google.com/rss/articles/CBMilgFBVV95cUxPNjdJaTl0bTAwcldTeC1JRnRoaFhfWTNnUENxQ19FZDFIcE92NDBOVnpIcEhNaEtOU2VPdlNnOTJXWkJiQXJMdnkwcmhGNWNZRl9QX0Y4UFRqR0czUjU2NVZOTUx2WDAzNHdVdlMwZDdJMmJjZDFmLVh6YU5tNmZlbEZpV05jc3MzNFdMbE5aTXRpOHVyaVE?oc=5,How to prompt Copilot or ChatGPT to accurately troubleshoot your PC - without the AI overconfidence,How to prompt Copilot or ChatGPT to accurately troubleshoot your PC - without the AI overconfidence  ZDNET,2026-06-22,web,False,False,google_news_rss,55,neutral
32a9d196b55e26c9,2026-06-22T18:05:43Z,openai,OpenAI,ChatGPT,Seeking Alpha,news_article,news.google.com,https://news.google.com/rss/articles/CBMiwgFBVV95cUxNZ3pBaDFSLXdVYzczNDdyQ3VWcTRVSEJBT0wyeUFnTHRVUlNyM2lJWElfSHliaVlNR1J4NDRmNm9uQ0k1Q0pJUE5RejdBVWZ2cFRqQ2VMdXN5cmlJOUU4aWV2MXRoaC1IWHcyWTRmNEJIRWNrbWkzUVZ6bnJzc2QtWVhBVkdiQVUyQ1pRODVSSW51OTlMWjZ3TDVhMG5mMHhxeTBZNFNXSHJjczE0ck1YNEhJMXpiOUhEMVNueU5paEhEdw?oc=5,"Interactive Brokers expands agentic trading capabilities with ChatGPT, Grok integration (IBKR:NASDAQ)","Interactive Brokers expands agentic trading capabilities with ChatGPT, Grok integration (IBKR:NASDAQ)  Seeking Alpha",2026-06-22,web,False,False,google_news_rss,55,neutral
55791790e909900f,2026-06-22T18:05:43Z,openai,OpenAI,ChatGPT,Tom's Guide,news_article,news.google.com,https://news.google.com/rss/articles/CBMiswFBVV95cUxQYV9EZkJ2aXdxaC1jb2tKSVp4S3YyWjloakV3aFRKLUExTlZ4MGtZZ0k1Q3N3UVlsS09JcjJuRVZNQVRoMW9qSng3TUl5TVo2cjBUb3VjWjRVZVV1dVk2V0hEdmZtTDI5VmV5OFVOeGdXQ0lPQjZtdVEwVHMzSlQ2bE8ta0dDMld5NnJBWEVrenlBbkNVRXBrVlZsN0o1UEJLN0dCaXlLQWpTUzVzdkhDRzFpOA?oc=5,I used ChatGPT to discover my hidden strengths — and it changed my perspective on work,I used ChatGPT to discover my hidden strengths — and it changed my perspective on work  Tom's Guide,2026-06-22,web,False,False,google_news_rss,55,neutral
6856a012ac5f246b,2026-06-22T18:05:43Z,openai,OpenAI,ChatGPT,AI News,news_article,news.google.com,https://news.google.com/rss/articles/CBMilAFBVV95cUxOb2ZCci1kX1BxU3JXX0VPNTFqXy12WVZOVDBFbjgxMDlYOE9TR0lCZl9FZXZ2bXp4cEF5bHBNRVFQalRIb3N5aHM2Vk9NQzlJN3ZuV3JyVnd1T0phSDFiOFhLM1NmWW9oX0RkQ3hKSTQxZGx1eTRtZXE3VWg0NUxlVk1UOTEtdWNOazlESE8wWXJ1SVJz?oc=5,L’Oréal brings Maybelline virtual try-on to ChatGPT,L’Oréal brings Maybelline virtual try-on to ChatGPT  AI News,2026-06-22,web,False,False,google_news_rss,55,neutral
f959a88565e7f4ba,2026-06-22T18:05:43Z,openai,OpenAI,ChatGPT,TechRadar,news_article,news.google.com,https://news.google.com/rss/articles/CBMi4gFBVV95cUxNSVNuX2xDNlctUUtJZmdsWm9xMU9rMGRJanJYWEo1OTQ3NjJuWHVjckRtWF9IcWxQelpIRTFuMWZpYUtqMWRTeU1JQzZnN0p3OGVjdHFmM3oyaEVYRndVWlBOdnhrdGFoOEl5Sk1KaWhzbmxkV1ZPRGFyNVBWa0VIQnRRWXhaMlY4aUhmd0t3LV95d2hYamtHUV9SSDFiaXNKcnh0TWh4OEpRR05IQ0dlbHZ6RXpNZGtLNmNQNElITHNSMkFJRnNia1FHckpxUkd4MXNOaWZpZEJhQ0pkOW8wdXd3?oc=5,ChatGPT thinks it knows my next obsession — and I'm not sure it's wrong,ChatGPT thinks it knows my next obsession — and I'm not sure it's wrong  TechRadar,2026-06-22,web,False,False,google_news_rss,55,neutral
68db3828f6fc8bf5,2026-06-22T18:05:43Z,openai,OpenAI,ChatGPT,Review of Optometry,news_article,news.google.com,https://news.google.com/rss/articles/CBMitAFBVV95cUxONF9uT2l5a3dkQTRFR1FLamZiNHNCUzlQQ3JPMFBHa3hXSExqeGY3aHF3X05NVXdheFFRQW9yOU9jZU9tWkZBeUZFeHMwaHoyR1pNdXR5cEEzWGRoOVcyUk16THYxaVNydnNzNUFDeEZIa1ZtMWllSUdrdzJFN0xESmxWcDVsRmtOTEdudzR5RGd5ck15YVlIRXpNX2NQVm5Xa2ptbWI5MTBuWTVBTUE2TGZmazk?oc=5,ChatGPT Overestimates Success When Predicting FTMH Surgery Outcomes,ChatGPT Overestimates Success When Predicting FTMH Surgery Outcomes  Review of Optometry,2026-06-22,web,False,False,google_news_rss,55,neutral
415a2a2c1602368d,2026-06-22T18:05:43Z,openai,OpenAI,ChatGPT,The Times,news_article,news.google.com,https://news.google.com/rss/articles/CBMijwFBVV95cUxPOUJ5a25iMUNSSURwSDZiOXZ1bkNBbi04SmlYRlpyWTRtUERzUnRaMHZrUm9jZ2w3Q25NZXRVOGo4QTcydjNDM2xkSHRJYlk5cVdiRG9SR2ttalJ5dXRPMWtxQnJyWGhQM2hGVllILW9oN01fdE5peGpfNkdrcDV0NWtGV1lJQy15T09FWDNuZw?oc=5,Getty Images gives ChatGPT access to its vast picture archive,Getty Images gives ChatGPT access to its vast picture archive  The Times,2026-06-22,web,False,False,google_news_rss,55,neutral
