mention_id,scan_date,brand_id,brand_name,product,source_name,source_type,domain,url,title,snippet,published_date,platform,is_first_party,is_partner_or_reseller,discovery_source,signal_score,sentiment
d45454a1ce024e54,2026-06-08T16:57:38Z,github,GitHub,GitHub Copilot,Help Net Security,news_article,news.google.com,https://news.google.com/rss/articles/CBMihgFBVV95cUxNbXdfT1ZBZ1BYWU9IaWtvanNZaHd2djFJWF8tMkNLVnBYQV93X2VWTFZmYjVPRk0weVNfbThXNXo3UUVBZG92THV3NXowb2Q0WkE1Tmc1WjgyT0RmYzdIQnNHc2xpcGxOb0NmeC1JVDhyOUxQaWhKU1UzR0I2ckFNcWZmSnV6Zw?oc=5,GitHub Copilot app launches as desktop home for AI coding agents,GitHub Copilot app launches as desktop home for AI coding agents  Help Net Security,2026-06-08,web,False,False,google_news_rss,55,neutral
b5dd93a38dcde906,2026-06-08T16:57:42Z,github,GitHub,GitHub Copilot,Technology Org,news_article,news.google.com,https://news.google.com/rss/articles/CBMihgFBVV95cUxPdmtDOWlTcjZud2NpVzZwN3RZVUV3UkNaSElMRlVtUTlBaVpZYjhXZW5mTWkyVlV0RkZLelFtLXhNMzUwSkFudmxfYnI4LTJObG5OUUxSdENQeVZrbl8xVzhzdExsdWd1aG40T281YTMwR1ktTzlMbGJNdnBha3BqM1FHc2VFUQ?oc=5,Copilot’s Token Billing Signals AI Pricing Reckoning?,Copilot’s Token Billing Signals AI Pricing Reckoning?  Technology Org,2026-06-08,web,False,False,google_news_rss,55,neutral
d77a2b9ec7ad477e,2026-06-08T16:57:42Z,github,GitHub,GitHub Copilot,Fathom Journal,news_article,news.google.com,https://news.google.com/rss/articles/CBMidkFVX3lxTE43MlhnYm84Z3ZpYjM4NDBEamphVHBiS2E2Vy1YU0VTcGVMbWx1dllOVXBsYmRrM3I5N3pLREV5NnhBQm9GRWpjbms1QWJXOVNpS0g5ZXV2dmhYeXlTRjhLLVhaNV9zS0ZGMHVDU0UwdnI5NG5IZEE?oc=5,First Look: The New GitHub Copilot App! (UsvxwzNcEl),First Look: The New GitHub Copilot App! (UsvxwzNcEl)  Fathom Journal,2026-06-06,web,False,False,google_news_rss,55,neutral
28d2c8a9e16eb504,2026-06-08T16:58:08Z,vercel,Vercel,Next.js,Fathom Journal,news_article,news.google.com,https://news.google.com/rss/articles/CBMidkFVX3lxTE1aYXB5OGlQb2s5dVROemxwQ2ZMMmNjZG0zNXlaanJTUXd0dTBncm9GQnMyb0VsejQ1SGVFcFI2a19VTkh2dHNRLUpsOG04amlEM0pwY0RITXBteFpXSE9MRng0VWw5ZWtJN1hMNVVMRHFQQ0pDamc?oc=5,Cloudflare Built Next.js Clone In One Week! (RDE4RGZnjk),Cloudflare Built Next.js Clone In One Week! (RDE4RGZnjk)  Fathom Journal,2026-06-06,web,False,False,google_news_rss,55,neutral
6b00fdddaf2e3e0d,2026-06-08T16:57:35Z,openai,OpenAI,OpenAI (general),TechCrunch,trade_publication,techcrunch.com,https://techcrunch.com/2026/06/07/openai-is-still-working-on-that-super-app/,OpenAI is still working on that ‘super app’,"""Chat is dead"" — at least, according to a senior OpenAI employee.",2026-06-07,web,False,False,known_rss,50,neutral
89dc0662850a13f5,2026-06-08T16:57:42Z,github,GitHub,GitHub Copilot,The New Stack,news_article,news.google.com,https://news.google.com/rss/articles/CBMiX0FVX3lxTE9uTWd1cjZxMVVLUm5DT0xnM3FRNFpiUjZkTHcwU1dvQmpudGJDNlVnX1dQNXA5RGx1Q3FrRUFpNWlJOGdhdklMbV80VWZtSzVlRE9XbXlZU2dPRFNkSmpr?oc=5,GitHub takes aim at Claude Code and Codex with its new Copilot app,GitHub takes aim at Claude Code and Codex with its new Copilot app  The New Stack,2026-05-16,web,False,False,google_news_rss,50,neutral
b2d3469a1560905b,2026-06-08T16:57:09Z,openai,OpenAI,OpenAI (general),Business Insider,news_article,news.google.com,https://news.google.com/rss/articles/CBMirAFBVV95cUxPNkpHektOZ2NyRXdPYm9pdHc3Sjg1ZlBINWpmeE00M2tNdU0wUjRmdVdpbHowQ1NnWUNGN1RvdUZJS2hfWTVsWXg3OXQzUExyRWdjMUVMZGRUbW9aMmVWbVBDelpfU3BkdUNYLS0wdHlBSkNSTVZSOWZWb2FVMzZoXzVSTmZud1FTUklGTjRyWjZYdW9FLWZqTWFUeFhQZUY0NFZCelNSTXdRNElh?oc=5,My family is selling a $2.6M home in Miami. We'd rather own OpenAI or Anthropic stock than keep it as a rental property.,My family is selling a $2.6M home in Miami. We'd rather own OpenAI or Anthropic stock than keep it as a rental property.  Business Insider,2026-06-07,web,False,False,google_news_rss,45,neutral
9c02ad75c9480341,2026-06-08T16:57:09Z,openai,OpenAI,OpenAI (general),Yahoo Finance,news_article,news.google.com,https://news.google.com/rss/articles/CBMipAFBVV95cUxPaGoydWdvbWJ6MlVsMTVhUXdHbGphVVIzRW5ZR1dueFItNmFnei1CMmZ1UWdjMUs3ZFhMYjdRMUNrRGotNUVGYTNsYjhNdzJTUUNvUXZNT0lGM2xkb2dzY25kWHdFTTd4cVl2OFdTalNMLTdncDl0S2ZBeWlJVy1CZzQzTVpvdjdrSUdKWVFRQXVqdUJGSW1ab2U0YUxBQ0tnUWJHVw?oc=5,OpenAI Gets Kneecapped by a Major Investor at the Worst Possible Moment,OpenAI Gets Kneecapped by a Major Investor at the Worst Possible Moment  Yahoo Finance,2026-06-08,web,False,False,google_news_rss,45,neutral
401692db1bcb5668,2026-06-08T16:57:09Z,openai,OpenAI,OpenAI (general),The Information,news_article,news.google.com,https://news.google.com/rss/articles/CBMi0gFBVV95cUxOUWt6R2JRMkVvekxvYXNGd2szNHRwX0ZuZkxGQ3BBallsaGQ5bldVaDZKaEZ1US10TDdyd01oSlBqdzJocFJlTHJXbEwwajUtTktxeXhzQmtDcDRmbXpUS1ZraHhBQUZvUmx0R2F6VnBfZUZxeW1HOGlOOUpWT1NaZ2NnRjRuS2h1cEZ2MEE2c0RDbWltcVFVNkpONXY2Q3NIcU04ejg3eVltOHpKN0xFRW04ZzJnVmptelpDQkNTYnNFQ242TDB2TWJ5cW1TWERwMkE?oc=5,Developers of OpenAI’s Stargate Data Center Face Higher Costs From Energy Challenges,Developers of OpenAI’s Stargate Data Center Face Higher Costs From Energy Challenges  The Information,2026-06-08,web,False,False,google_news_rss,45,neutral
a2dbcdff5cf3605b,2026-06-08T16:57:09Z,openai,OpenAI,OpenAI (general),CNBC,news_article,news.google.com,https://news.google.com/rss/articles/CBMiwgFBVV95cUxNT285MzhaMzE0LUV4YkRFd1djNzl5aVlBVEZaYWNydE1Ma0ZVWnhkSnRLcFRVUS1ObXFyVXNYSkExTUI4dld5UWRmNWFOMXI4dERWekF1QUoyZ3U2RFNzNGRaNjhjdmZXS2FFbENKOHNXX2RlaXdpU3FpaDFsbFlPUXF0NHJqZEVpMThsbG1nTGVLNVYwcFo0bFhSRU9IVTA0WkJJY2FoY01GeGpYcDVQVExXS29fM0g4aHRNcEE2QzhPUQ?oc=5,OpenAI Chief Global Affairs Officer Chris Lehane on AI's impact on jobs and people,OpenAI Chief Global Affairs Officer Chris Lehane on AI's impact on jobs and people  CNBC,2026-06-08,web,False,False,google_news_rss,45,neutral
608d237a33237686,2026-06-08T16:57:09Z,openai,OpenAI,OpenAI (general),VnExpress International,news_article,news.google.com,https://news.google.com/rss/articles/CBMixgFBVV95cUxPX1V4ZHZxQm9jN3BUckdLVmt3Ty1zMWVpZ0Q1ZXVwUDM2eEIyT2xfb3ZxVktua29LSEJqWmRiSGNWR2ZsakdybHctZG5LdHd4OFFLdEtkMDNFcUhNQ0ZmdVRPckRlTi1lMDRkSXJIMmw5MUFIcU5qbU10VEVxeXJ0TDl0UUZ1OFk1NGRYckYyNTFZaDFINWdFc3NsT29obGk2VUJxcndfMHRKNmZJYk5uREtPQmRla1YwZUoyRlRXQWxUTGM0Q2c?oc=5,Youngest Chinese full professor at Harvard reportedly joins OpenAI,Youngest Chinese full professor at Harvard reportedly joins OpenAI  VnExpress International,2026-06-08,web,False,False,google_news_rss,45,neutral
9f84e30b4442bb64,2026-06-08T16:57:09Z,openai,OpenAI,OpenAI (general),The Times of India,news_article,news.google.com,https://news.google.com/rss/articles/CBMi-AFBVV95cUxPSmlyazBMUGo1alNIY1VueXFIcEZENnZYUFJDQnNVQ3JZRHN5aUs4bXAwWm1MSzRZbXVXZndZdGR0Q0YyZGFNZ25xNHJYcWU1TUNjSi1IajRuSllsT2hfeTlxYUViOTJGNUd4OEM5YWljdVd4UC1HNW1jSXBFc3pzeVY5eWhxajNyeVdTNXJXUUNEUnp3UmpITTQzYTdSVFl4c212RlI1N0ZUWGI3Nk5yZUZmUnN3bUJRUmxsczQ5V2NWQWZsVW5US3E1MjRjZndXdXJzUXJYcGhXSW1GTzlsdFN0U1gtdU1aUHRhYURNanhSU2MtR0g3U9IB_gFBVV95cUxNM0M0bmpET1hhbGI1V3dXd0xjSzJGSEVxVlg5cEZ3eEhrb2FQNDZCbUNwZ0xnSDVGQlhNY0dPQ2VFbTZ2dHAwZnJzUHhlZTlJSDVyMVRGQjRrZHU4TG9UOUJmTFZaclFOY25RWTFuSGtQOEZyMUM5cjBtY1BPdFZMYU1UdXpZeEwtQnN1MUVoUEVOVWhTVW05MjFKcHBvdldoUHlRUVBRQW42Vm52TnEzM18zM2pWVXdFNHR4QzJERU1NZlZQTW5NMk9waV9ZMGJqczRrVkNtNXR4bkdnQU56SGZ3YmxBQ1ZiemZrTGo5UEpGU3Q2NjdzM2g3VTJLQQ?oc=5,OpenAI CFO Sarah Friar: I wouldn't hire a finance person who doesn’t know how to use …,OpenAI CFO Sarah Friar: I wouldn't hire a finance person who doesn’t know how to use …  The Times of India,2026-06-08,web,False,False,google_news_rss,45,neutral
dd43347e10ab2b6a,2026-06-08T16:57:09Z,openai,OpenAI,OpenAI (general),NC Newsline,news_article,news.google.com,https://news.google.com/rss/articles/CBMiwgFBVV95cUxOWmJmaG1UYWNtSnYtU2k2NFZKZmEzOEJ1V19EdmJnQ3lsZUFQSlFnMFJjS1RtTE02QW14SHh1NEw0YTFObmNqdjdEWEtmTmViRE4wM18ycjJ4cnBfSDU3OXNabEtpN1dRX2dqeEdfNWJxU1dmNUdIUF82SUdPQXJ4NGlWekgtM0J6ZVltZDhUdmtJNnJuaFVaa1kwaXUtNTk1Um1MLUFULWQ2V0M5dmVDNm9maTNLeHhlVkY0bkpvSjJndw?oc=5,"NC members of Congress call on Google, OpenAI to address chatbot involvement in mass shootings","NC members of Congress call on Google, OpenAI to address chatbot involvement in mass shootings  NC Newsline",2026-06-08,web,False,False,google_news_rss,45,neutral
4b31626adb233c68,2026-06-08T16:57:09Z,openai,OpenAI,OpenAI (general),24/7 Wall St.,news_article,news.google.com,https://news.google.com/rss/articles/CBMitgFBVV95cUxOQlk2MVpGQlhUOU1FWUpTTGVVaUVZU2VYbDhYbXRKZzhsV1p1NjBNT20xenl1eDVlbnVTbzJnc1NXZmktSHp1aGRvWUJQOVBUUUJIaEZvOFAzd191X2djbWItTlRSS3RKS2JPVmxfOVhNMjBMbnhmRDNkYVp1OVhCcm9TMThqV04yUTJkMUZXNmFTWUlfNlluQXBnTVpJSDVqUXg4R0diWUNmb1lUT3Z2TGhXckhKUQ?oc=5,OpenAI Gets Kneecapped by a Major Investor at the Worst Possible Moment,OpenAI Gets Kneecapped by a Major Investor at the Worst Possible Moment  24/7 Wall St.,2026-06-08,web,False,False,google_news_rss,45,neutral
6d1ef151f48658d4,2026-06-08T16:57:09Z,openai,OpenAI,OpenAI (general),SiliconANGLE,news_article,news.google.com,https://news.google.com/rss/articles/CBMiowFBVV95cUxOME5PZVFsNHE4UnNKcHBwVWFZemY1NUdmNlUySm9DaGRtQVItXzlqS1hQTHNndFhiVGNNaDl1MFpWLWpJcmMzOTlocUllVmZvdHRyaHlIamFvSFJneld0TW5tYm5keGdHclptQ3hmMU8tZDd1SllGcVJLNzdWNFlWLWpGVzZXcEFTbFFYY2x3dlc2Z3pLc3JSRHpwaEsxdzFUZTY0?oc=5,OpenAI’s planned ‘superapp’ gets closer as one employee says ‘chat is dead’,OpenAI’s planned ‘superapp’ gets closer as one employee says ‘chat is dead’  SiliconANGLE,2026-06-07,web,False,False,google_news_rss,45,neutral
2756362d701390c5,2026-06-08T16:57:38Z,github,GitHub,GitHub (general),The Register,news_article,news.google.com,https://news.google.com/rss/articles/CBMitAFBVV95cUxOelh1TmxNc3k2VnZtQ01yTFNHX29rTUQyUmNqN1JBWUZFcW1MT3lSSC11amxuNzQ3cUlKVWE0Q19uNmJybTQzVDNBS1hnMWl4R1M1d21MZk5RcFJPZGFkZ2dpM1R3UnVJUlZ3aW91eTdqYWFvUm9QM3VyenFkb0VENTZRSG02UXNVY1NVUDlGc2V4Q0hKM2JsUWlSMWxpdEdhMDh6d0pSZTgwY2pZekhobDNKVk0?oc=5,"GitHub nukes 70+ Microsoft repos, breaks CI/CD pipelines, following suspected worm infections","GitHub nukes 70+ Microsoft repos, breaks CI/CD pipelines, following suspected worm infections  The Register",2026-06-08,web,False,False,google_news_rss,45,neutral
879f3874650f3633,2026-06-08T16:57:38Z,github,GitHub,GitHub (general),CyberSecurityNews,news_article,news.google.com,https://news.google.com/rss/articles/CBMifEFVX3lxTE1tcXpHSDV1M21XcEZKYlE4Mm9kZnJ5V09LUlc5T3VUVTE1MGF2MFU1WXE2MUNmZms2TGlFY0kta3U1NFY3MGlJdXhyMDlSNXN2TEZEQVg3VGhlbjM3bjdIcERLM2V5dWR1M1hhdmtCR2VtQl9kVnVFdTFzQmzSAYIBQVVfeXFMTTVtczhWLTBRRmktNzJkWlh5bGx3TjVWSWV5NkdaNy1GV3pYeWlkc3VvQlZBRXVqcTM5VVd6U1Bfb2thdTFmcndUcUFoU3NSaDNoZFRxQzB1LUZfZE0wODh4eWJ1TTdVV1FIa3ltb3N2UnJXM0NLR1RRR1hNbndJVDctQQ?oc=5,Microsoft Warns Claude Code GitHub Action Could Leak CI/CD Workflow Secrets,Microsoft Warns Claude Code GitHub Action Could Leak CI/CD Workflow Secrets  CyberSecurityNews,2026-06-08,web,False,False,google_news_rss,45,neutral
271e417098c8dfda,2026-06-08T16:57:38Z,github,GitHub,GitHub (general),The Hacker News,news_article,news.google.com,https://news.google.com/rss/articles/CBMigAFBVV95cUxNeC1zM190ZGYyRVd5Wjc0dFlqcXdjeTFEZldIb0JNTGhNdTdVOURINV9LUVBTNmNCM0Q2SjJMaWlRMnZjaGFsQ3JWVW0tSkJfeVZVNTFxY0dSeUd1YW5iem9pUGJIVjhmY1hsbU45bjEtYWJEbktXNmVrWk5INmFZVw?oc=5,"⚡ Weekly Recap: Instagram Account Hacks, Android Zero-Day, GitHub Worm and More","⚡ Weekly Recap: Instagram Account Hacks, Android Zero-Day, GitHub Worm and More  The Hacker News",2026-06-08,web,False,False,google_news_rss,45,neutral
9207327f7e16fba0,2026-06-08T16:57:38Z,github,GitHub,GitHub (general),Augment Code,news_article,news.google.com,https://news.google.com/rss/articles/CBMiZ0FVX3lxTFBMcFQxdTZTSnFGOFBndTV0OWl3Smx1NHVlVXF2YWhqd0ZFTmMxZFl5MzItS2hpTHpvN29rcktzc0Jna1JkQXBCd1lZZl9lYjVSRFlVLWVpVHMwNFpzY3dQRkQ4WVBGc0k?oc=5,Anthropic's Claude Code hits 131K GitHub stars: why developers are skipping the IDE,Anthropic's Claude Code hits 131K GitHub stars: why developers are skipping the IDE  Augment Code,2026-06-08,web,False,False,google_news_rss,45,neutral
bb858ca785d227f0,2026-06-08T16:58:04Z,vercel,Vercel,Vercel (general),newswire.com,news_article,news.google.com,https://news.google.com/rss/articles/CBMiqAFBVV95cUxNaG5CSkZCWmZhWDFwTURKV1RCN0FtWDNRUVktM3V2RVVReXF3TW9LNFQ4WnI3VkM3Z09ZNlk3RUw1YmFtbzRoMnpWR2VBUldxNUR2cDZUd0VDWFp2M1BVUlF2QnNfTUlYeG1DZHNtdXdnVU1DSnF0RkVnS3psemhQQVNNdWd0dmdyb25xY09jNUpZaEpfa3V3WDA3OWZCMTVIcjZQczNXMEw?oc=5,"doola Brings LLC Formation to Vercel, Closing the Gap Between Deployment and Legal Infrastructure","doola Brings LLC Formation to Vercel, Closing the Gap Between Deployment and Legal Infrastructure  newswire.com",2026-06-08,web,False,False,google_news_rss,45,neutral
4497541bb0c73459,2026-06-08T16:58:04Z,vercel,Vercel,Vercel (general),saastr.com,news_article,news.google.com,https://news.google.com/rss/articles/CBMi5AFBVV95cUxNaktTMWhTNnk3NHZNRmg4dGxZZDdFb2xjRk85aFo3ZHVaSXBVbWhJTzBHaVZOamxFbGVEdlA1ZF9iblp4SUxueThxWEstdERiRWZDWUJibkg1ejRKVWc3RmxEbmY5V09uYkR6NUJaWU9zdm5yZXJpdEJkYjZWenN1OWVQSEVleUxzUU5qbEQ3XzN6MW42d2k0Q2lPZGxoM21Wb3N5blFUVDBSM1Z4UkV5NFFnTlRKa0d0MGFYSEwwUG8tZXp3LS1ScFZXc3JSS3VNcndMYXlaanZLQnBIeWRqSEljWWE?oc=5,"Building AI Agents That Actually Work: Lessons from Jason Lemkin, Jeanne DeWitt Grosser (Vercel), Amelia Lerutte & Amjad Masad (Replit)","Building AI Agents That Actually Work: Lessons from Jason Lemkin, Jeanne DeWitt Grosser (Vercel), Amelia Lerutte & Amjad Masad (Replit)  saastr.com",2026-06-08,web,False,False,google_news_rss,45,neutral
79fbf0cb1a34a635,2026-06-08T16:58:04Z,vercel,Vercel,Vercel (general),Tech Times,news_article,news.google.com,https://news.google.com/rss/articles/CBMi1gFBVV95cUxPVVFCanVKcHF2REl3LTBmYjZPbkNYMlJpMHJ2Mzg5aV9wUWdtTnhFbmxNSUFPSmNKUGxZU3d5WldZRjdVVFNLRDAxcGkxZDI3UHhJRDdKUUdZZFRWX3BYRmxrZ3diSEpxQU9fbU5hNFpQSnpCOUpPSUstRFNFYnJBZERMNVZQVWtWN2RQWXllQXEtRTY1RHRnNHRUbWhYNmNyampxd3htQ1Q5QkxTTWJoNzBCeVRtWXVTOGNzcExrTlhLU05jNGlVWGZVa3dMcHY4QzUzeGZB?oc=5,Vercel Terms Classify Third-Party AI Tools as Electronic Agents: Billing Falls on Developer,Vercel Terms Classify Third-Party AI Tools as Electronic Agents: Billing Falls on Developer  Tech Times,2026-06-08,web,False,False,google_news_rss,45,neutral
630c95dd7bc6d6cb,2026-06-08T16:57:17Z,openai,OpenAI,ChatGPT,OpenAI,news_article,news.google.com,https://news.google.com/rss/articles/CBMiV0FVX3lxTE9hLWhKaWFiOWZVUUloMWR6bGQtcEVzLWF0WERBN3ZUeTlGZEY5QnFFdzB4XzhXaHNoS2lvVnJmVjlaa3FpYTEzdTZiQW9nYzgxN183VXp4NA?oc=5,Scaling PostgreSQL to power 800 million ChatGPT users,Scaling PostgreSQL to power 800 million ChatGPT users  OpenAI,2026-01-22,web,False,False,google_news_rss,40,neutral
42716b413467ef66,2026-06-08T16:58:04Z,vercel,Vercel,Vercel (general),wiz.io,news_article,news.google.com,https://news.google.com/rss/articles/CBMiakFVX3lxTE5VLVRBenVFQk04Ty1pQkhVOGY0UEpSaFlKeS1mVGxMcmhpY2oyaHFrcjBYbm1SSWR0RTAzSllwMVVFaGt2MDNGZWJULW5ZaVpKbXBHZEo2VzVqaWJBNkpSUy1fb3p4UVp5TXc?oc=5,Bringing Security Visibility to Vercel with Wiz,Bringing Security Visibility to Vercel with Wiz  wiz.io,2026-04-09,web,False,False,google_news_rss,35,neutral
6e868f2eaa327ec6,2026-06-08T16:58:11Z,vercel,Vercel,Next.js,MarkTechPost,news_article,news.google.com,https://news.google.com/rss/articles/CBMi_wFBVV95cUxQMHFaU3ZnSkVVWmlKbWUwc1pLUzRxei1nblhQM21ETTV2dU1hWWhvQ1VvVDJtMks0ZjVqdFQ1ZUowQkI0WS1NZW5tZHRWeTAyY09rdGthak93U2xrS0xKSEd2ZEowc2NXU19pMHdZU015YU94ZG14LWM1bVd4cUEyRU1ONVhxTW5ZNUE0V0hfZ0F5cXZOcUs1Umx4OVB3NUg3VzJSYWxQRFFaVDhFR015VVJFWGRIWnBHNnhneEJldVBlZndJSUdlX1FTZmIyMFJ2QjVqZkhTOHhRaW9qUWNlVlFLclVNeWViQkRyOTQ3NlBWWTkyY0NNWlFCZHpiTGM?oc=5,"AI Artifacts App: An Open Source Version of Anthropic Artifacts that can Analyze Python Code, Generate HTML/CSS/JS and Next.js Code","AI Artifacts App: An Open Source Version of Anthropic Artifacts that can Analyze Python Code, Generate HTML/CSS/JS and Next.js Code  MarkTechPost",2024-07-19,web,False,False,google_news_rss,35,neutral
2b671d9e5abe77c7,2026-06-08T16:57:17Z,openai,OpenAI,OpenAI (general),The Decoder,news_article,news.google.com,https://news.google.com/rss/articles/CBMihAFBVV95cUxNOF9Xa1FnSkVKRnJ1X0JCQmdBdk0wbm9Qb1IwNjJSNjJDbFJkWm14TkpVSFlrT1lBR2xTUkJiOTQ0Vkp2VjgzazNrM3EtWFExNDRXcl9IYk9icU9LWmhZYmQ2UjlzanpnTl9WSzNyZ2tFU1VEQVQ2NTBFdjVUSmp2TkhYbG0?oc=5,OpenAI's API business grew by $1 billion ARR last month,OpenAI's API business grew by $1 billion ARR last month  The Decoder,2026-01-23,web,False,False,google_news_rss,30,neutral
555b050f609c7503,2026-06-09T16:18:58Z,openai,OpenAI,ChatGPT,Gizmodo,news_article,news.google.com,https://news.google.com/rss/articles/CBMingFBVV95cUxQVi1nX1VJcnZjT0lZS05SSkxUeHZjY0FYLVpqU0NVQ2RWRjh5RTRnM1ZRandocjZFeWtCOG12VW9kRUE0RjhXaWJqRER0NkxpQVlRZEhHcHlPWkZSNlpaclFvVmhyczF1dm42Ykd3R01ETFRNZzlLdnFIaEJoZ3hnblJEc0U2ZEZqT0l2TnpDR0NydFJycFJiNzRLMXVrZw?oc=5,‘Chat Is Dead’: OpenAI Reportedly Planning Radical Changes to ChatGPT,‘Chat Is Dead’: OpenAI Reportedly Planning Radical Changes to ChatGPT  Gizmodo,2026-06-07,web,False,False,google_news_rss,55,neutral
e6483c6d6cd5834b,2026-06-09T16:19:01Z,openai,OpenAI,ChatGPT,Yahoo Finance,news_article,news.google.com,https://news.google.com/rss/articles/CBMinAFBVV95cUxPNUs1b05fRVU5NHFhX3pIZGZERGducXBTX0QtT0hiVmJic2s4QV94Rmt3NW5aUzd6Z3lPSmcxRzVZTGpKQUFBNWlhMlJXMkpJSVVic3BEWTlkSmlTUzR5TXVMYWF3NURqSW0zUFFBRGtEeW9XR1k3ajZpdnhCaGxSNnNyempTSWVEMGJCLW5VMUQzYUE0TE16ek9UcGs?oc=5,AI XRP Price Prediction: ChatGPT Forecasts XRP Price After 19% Slide,AI XRP Price Prediction: ChatGPT Forecasts XRP Price After 19% Slide  Yahoo Finance,2026-06-08,web,False,False,google_news_rss,55,neutral
6123431f5795d099,2026-06-09T16:19:01Z,openai,OpenAI,ChatGPT,vox.com,news_article,news.google.com,https://news.google.com/rss/articles/CBMilgFBVV95cUxOUlRxck5IbXNBclB2SExvbVE0TUFobUl3TnNXNlhWYjdMSWdyRDhib01rOUpMWmtCMkNGV3VqRkNtMGNJNWtrd1MxVG5GZEp6SGpKcUZUaWJWdnBybVJhVWFlblpWc2JsY3JUQWJnVUVjSl9mZzVsTnhlYVo4ZlFwR1dLeUlaMHVwQXRHdDdRSkJWWWFZM2c?oc=5,The couples using ChatGPT as their therapist,The couples using ChatGPT as their therapist  vox.com,2026-06-09,web,False,False,google_news_rss,55,neutral
2376d2093cb12193,2026-06-09T16:19:01Z,openai,OpenAI,ChatGPT,Sherwood News,news_article,news.google.com,https://news.google.com/rss/articles/CBMickFVX3lxTE5oOHlub1kzS2pTMmdUZUtHV3dUZ0YyVzN2akpVYmttYV9NM3BYWkl4emc0QS16dzVwYVJraWd0V3JMeERjRVY0Q0dmTjA3TUJscnJkUmdxUVNocFZLcXNtM01LUEtnNXdIdjdTTFdFS3NJZw?oc=5,ChatGPT failed to kill Google Search,ChatGPT failed to kill Google Search  Sherwood News,2026-06-08,web,False,False,google_news_rss,55,neutral
8982af66793e8e0a,2026-06-09T16:19:01Z,openai,OpenAI,ChatGPT,Class Action Lawsuits,news_article,news.google.com,https://news.google.com/rss/articles/CBMi2gFBVV95cUxPSDFLUVMzdlVrR1N4OUJtekVWbDZVcXhBLWxhU2dxUVZ0WEpwR1h3VVYxQS1YOUVnTEpaeW4yeWppUHhBZnNwaS1ueDFqdmFQV05PRVRZTnNVOEFJY0JIaVlFbEFCb2dMb1g0TmFQMTBNUVhVVkdRMDNPOGZKU0p6SkxNd0JKWXV3enFnRmVYMENBUjk4RTBpTFMtSFJOSFlxTWVNbVRRSE9xci1QOUdRTHJhbGJnVGY0aHFEVGdBTW1SVWoyZ1RVbV9lNnZlY2ktLThnaUFzYmc4Zw?oc=5,"Florida lawsuit claims ChatGPT encourages violence, deceives parents about safety","Florida lawsuit claims ChatGPT encourages violence, deceives parents about safety  Class Action Lawsuits",2026-06-08,web,False,False,google_news_rss,55,neutral
1b7cd71e1f4d7488,2026-06-09T16:19:01Z,openai,OpenAI,ChatGPT,Space Daily,news_article,news.google.com,https://news.google.com/rss/articles/CBMiogJBVV95cUxOSnlIdy1Dd0RBODRKRmpmQThXLUIyUzJ3Q0VfN1RTcjVTZ2pNMjFWdnRtZ1RUYXcwVmUxZi04RXo4LS12dUNJUXNrMVhxMVFTVWRhWWxEQXNFdWpRZlRfWlJaeHZDenJSYVhyaDJPaE5xaVdVSU1GbzE1czZ3WmtzNFNwU2xiRnQ5cklGZWs2bmJ1c0NUanNpbzlveHhCVG45MUZGQlVEcEV4eWhKQWc2bVdRbkJHQzRXYlc1WWdvMEJjTmtlczVKODQ4YXhwSzlOczJ6VHIteGZaWndCVmFleUFnSXotRVZ3RjE2c29IVkJWX2xnU3ROTmMxcVh4dmd5Uzk3TVZ6ak9USDdDbnJVV283bUFmaE85RldGUzZuZEJCZw?oc=5,"Sixty years before ChatGPT, a chatbot called ELIZA was already making people pour their secrets into a computer — and its creator considered that a catastrophe, not a success","Sixty years before ChatGPT, a chatbot called ELIZA was already making people pour their secrets into a computer — and its creator considered that a catastrophe, not a success  Space Daily",2026-06-08,web,False,False,google_news_rss,55,neutral
c22e4b24079be7cb,2026-06-09T16:19:01Z,openai,OpenAI,ChatGPT,Decrypt,news_article,news.google.com,https://news.google.com/rss/articles/CBMihgFBVV95cUxPbHhscVRJd0VMbVFvOHQzczkyTzJvbkQ2QXhUaTB5NjFnX2JIM2JYUHBmRDFfOXhLdllpN0pLdGxOejF1Qk55LUR4Z1hPRi1nQW1nWW9teDBsM1EzRVBMaTcyd0RwdnViclBXV1NCS0tWU2lBTzB3Qkd4S2I5ek9GY1RtY01DZ9IBjgFBVV95cUxNOThRSGVITnlkR2RiRl83UzFxc1E2VWFCdkd2dl9xTV94YS1PTWxZTy1ES2ZjcXFJMjk3Zm13cWpJMmJ0UDBxakxONTlrdm51SHVUNjd0VHRUWmszbnU3Skt2UDhpUXVVU29FX3ByOUxBaGMxUjJ2ZjRmc3lIZ0ZmU2doeXYtS0dFY0xaNi1n?oc=5,China's Xiaomi MiMo Is Now 15X Faster Than ChatGPT and Claude,China's Xiaomi MiMo Is Now 15X Faster Than ChatGPT and Claude  Decrypt,2026-06-08,web,False,False,google_news_rss,55,neutral
8828ca1e2a63720f,2026-06-09T16:19:01Z,openai,OpenAI,ChatGPT,Forbes,news_article,news.google.com,https://news.google.com/rss/articles/CBMirwFBVV95cUxNLVZVNm05V1JxSW9HUWE5dTRuaG0tWllNdXFQb2gta3NldERSQVN5ZUM0aW5hQmtBQjJDM3YybVdpT3Fhc1hrLTdCYmhBeUtjaHVLZUxENk5lQ0tUMmFoU2UydXp3SC0xcGR4eDdySmNhQ19jcE9YS2xlNXNWR25raFdEaF9yOC10eEVrQVNpUkJsQ0tkbjlkTkJ2UWF1LTRZZTdBUTdUcVM1Nzh3RElv?oc=5,How Solopreneurs Can Turn ChatGPT Into A Business Partner,How Solopreneurs Can Turn ChatGPT Into A Business Partner  Forbes,2026-06-09,web,False,False,google_news_rss,55,neutral
2063e52d65598d92,2026-06-09T16:19:01Z,openai,OpenAI,ChatGPT,entrepreneur.com,news_article,news.google.com,https://news.google.com/rss/articles/CBMiswFBVV95cUxQVUVrek5Cc1ZmallOZENDdXc5T1VtT3F6aWtNblY4TXNpaUhtZmhhcE1oNWx1eTM2SGZnQ2JoMkZuSnJ2ZklURnNwLUNNdG4zak8xcHkydVVleVRSUGdqeHdzaEc1cUU0RnZiNmY2dW8xdTVyakE4aXdxTXFMUVpHNXVPWG9lQVB4TTV6T0s5bkdMTnpiQThWQldVeG5pY252NDljY3RhazgtemVWYzdsMDNwcw?oc=5,'Chat Is Dead': OpenAI Plans to Relaunch a Version of ChatGPT That Prioritizes Agents Over Answers,'Chat Is Dead': OpenAI Plans to Relaunch a Version of ChatGPT That Prioritizes Agents Over Answers  entrepreneur.com,2026-06-08,web,False,False,google_news_rss,55,neutral
6481200871f88c1f,2026-06-09T16:19:01Z,openai,OpenAI,ChatGPT,Yahoo Finance Singapore,news_article,news.google.com,https://news.google.com/rss/articles/CBMijwFBVV95cUxPU0dSeFk5QjkydUNCZE4wcnZ4UThxazBaOXpURmxGYlBSN2JGY21uM1hldTNidDU4aURfYVFPVXM3RmYyNW84cDM0cVRwcUYxaXdEazNEOXdSR19sNGhJdzRuMHpiTThuNHNNVFRwMmJ1N3pPSTlsaFY3RndEX0F6eWdZVEh2NzIza1oxcFVDRQ?oc=5,Constant Contact Launches App in ChatGPT to Power AI-Driven Email Marketing,Constant Contact Launches App in ChatGPT to Power AI-Driven Email Marketing  Yahoo Finance Singapore,2026-06-09,web,False,False,google_news_rss,55,neutral
12dc2ce64ecfab9e,2026-06-09T16:19:01Z,openai,OpenAI,ChatGPT,For Construction Pros,news_article,news.google.com,https://news.google.com/rss/articles/CBMi4AFBVV95cUxNcklFaUtCZUJRMmJhM3lSNmplQk1VZlZyQmdhWmN6N0NTN3h2aXBkTHVMOERuelJ3V2RuRGxfaU9zR2ZqTV9DU0VkVXdTYnMyM0dXNUp1eWhyMlphOFdhajJGSzh4YkhuMXlyM2ZRV0hwY1NfMEItV0lsa2dhU2FWNmxwdEEycXBsSUtvbjBfei1ySHREUk9JVzR2X0dqZHQtaWZEZkllbXJlVHdsbjlNVGItajJkU0V0bnlTdE9GT3RwVmpDQjJzTnE3UUZYVWVLQURYZGNJNzlMSmd5MDFVRg?oc=5,United Rentals Expands AI Equipment Agent to ChatGPT From: United Rentals Inc.,United Rentals Expands AI Equipment Agent to ChatGPT From: United Rentals Inc.  For Construction Pros,2026-06-09,web,False,False,google_news_rss,55,neutral
c531fc572c4aecd5,2026-06-09T16:19:01Z,openai,OpenAI,ChatGPT,tech-insider.org,news_article,news.google.com,https://news.google.com/rss/articles/CBMiXEFVX3lxTE9CbTZtcTJnYnJ2eUZhMXl4OEhzQXNfZlFMSFVSTFBvSW1xOWEtcW84cWJDdkZJUXI1aWVXd1kxT2V0N0VERTFpTldXZTh4b0lTcmFhenlwM1VoLXVM?oc=5,Grok vs ChatGPT 2026: 1493 vs 1460 Arena Elo [Tested],Grok vs ChatGPT 2026: 1493 vs 1460 Arena Elo [Tested]  tech-insider.org,2026-06-09,web,False,False,google_news_rss,55,neutral
632ebc1e6b241348,2026-06-09T16:19:29Z,github,GitHub,GitHub Copilot,Visual Studio Magazine,news_article,news.google.com,https://news.google.com/rss/articles/CBMiwAFBVV95cUxPUHB4Ymc5WWJyOGJndmt5NzBTZTdFME9PcG1jUUkzYmFwVUFiRmJON1U1MVNRQXEyeS1YWWtaeV9CdV9QUzZhbmtxaUtyekFkNVFLUDZPRWVlYU1LWWtOelV6bXF3QklLZmpzeVhMZndNVm1ybWJCUEUwUHYyYnYwRk03aFByZTVpVVB3eFJnOVdfQ0pqV3ZqYTJBUlV0cERyOG9BaWRHZG9fUnlZb1Y4SFg4R0xmcG1MU19SOFg0TFU?oc=5,Mastering AI Development and Building AI Apps with GitHub Copilot,Mastering AI Development and Building AI Apps with GitHub Copilot  Visual Studio Magazine,2026-06-09,web,False,False,google_news_rss,55,neutral
cf648a676fc1505a,2026-06-09T16:19:33Z,github,GitHub,GitHub Copilot,Tom's Hardware,news_article,news.google.com,https://news.google.com/rss/articles/CBMitgJBVV95cUxONkRSODRISlgydExaeUhiSkplVDA3Tk1vVlFPeTBPNDBJTjFmX0xuT0lOV1czRWlKdWVvdjhtbXVWMllTX2ZmN0dvWjJsMFVKaFl0UFI1d0ZDZkZMZzF3TVc4ZldPVkRHUmpLZElxVGVyUXJOOWdGZmNEZGp1OGlJeW5QdFhXZEJJaVZGVy11b05YSDNoUThTNHBmYVNoQjFOWGVlRUNvamZJSHQ0cTNTbnJGcHVldHhZN3NhVzdmdHBrWjBuTHpqLWRjZ2xpN1BpaFlEbkJSQUN6dUotcjkxNmJKNXZQMEFkbGZueEF5VFNBWGFXU0tES29SUWpfRmFWb1FLeF90RmFGUl9wMkliVzQ3WkJ6STQ4VllxaE50dk9OWklLZjFSZE9hR0l0b2JJemJDaUJn?oc=5,Linux developers are using AI vibe coding to keep vintage AMD GPUs alive — R600 driver cleaned up with GitHub Copilot gives HD 2000 to HD 6000 series a new lease of life,Linux developers are using AI vibe coding to keep vintage AMD GPUs alive — R600 driver cleaned up with GitHub Copilot gives HD 2000 to HD 6000 series a new lease of life  Tom's Hardware,2026-06-09,web,False,False,google_news_rss,55,neutral
