mention_id,scan_date,brand_id,brand_name,product,source_name,source_type,domain,url,title,snippet,published_date,platform,is_first_party,is_partner_or_reseller,discovery_source,signal_score,sentiment
586369fadac3066d,2026-06-05T17:11:15Z,github,GitHub,,Hacker News,news_article,news.ycombinator.com,https://news.ycombinator.com/item?id=48414869,Launch HN: General Instinct (YC P26) – Frontier models on edge devices,"Hey HN, Guanming and Bill here from General Instinct (https://general-instinct.com/).After years of working in robotics, we kept running into the same problem: the best models never fit the hardware we actually had available.The models that performed best were usually designed around datacenter assumptions: large GPUs, lots of memory bandwidth, and reliable network access. But most physical systems have the opposite constraints.That led us down the path of figuring out how much of a frontier mod",2026-06-05,web,False,False,known_rss,70,positive
9fc154dec4804130,2026-06-05T17:10:52Z,github,GitHub,GitHub Copilot,Visual Studio Magazine,news_article,news.google.com,https://news.google.com/rss/articles/CBMi0wFBVV95cUxObG1rMmgxOXRTRUszaWxHQkdGbDRxeHNIT3dTX0ZOZ3RjMmhXcXo4UVRsZ3ZkSnZDMUIzR3VtSWFBT0ZPOG5YVE5ZaWQ3a0trNGZPelpORnllVXJUTXB1M0NSLXBsNEpJdk9hbm9Uc3NZZDlrZURNRzZ1N3ZfVTNfNG9oSUdTMzBoZjQwSzhjR2dhSl9TYkp2V0xRbi1qUlRxeHhkUGgyTlJaVjdockFNR05UV05ETjhzam9SZFIzUEpzTDVPOHZjNFo1T2VwYnpvTElZ?oc=5,Hands On with GitHub Copilot App Technical Preview: Turning a Blazor Issue into a PR,Hands On with GitHub Copilot App Technical Preview: Turning a Blazor Issue into a PR  Visual Studio Magazine,2026-06-04,web,False,False,google_news_rss,60,negative
cf2df078130545af,2026-06-05T17:10:25Z,openai,OpenAI,ChatGPT,OpenAI,news_article,news.google.com,https://news.google.com/rss/articles/CBMiXkFVX3lxTFBOd2FyMkVXZ01LRFZHMHZ2Wk1HeTlSOEMtNGd0azhKMi1tT0JZWkZVaHR3UUdFS0NMUzZpNEtIcExsaVo3Y1BON3ExVWR6a3F3bkp6Y1FvV2s0bGZCWFE?oc=5,Dreaming: Better memory for a more helpful ChatGPT,Dreaming: Better memory for a more helpful ChatGPT  OpenAI,2026-06-04,web,False,False,google_news_rss,55,neutral
78f6e30813c012d7,2026-06-05T17:10:25Z,openai,OpenAI,ChatGPT,Engadget,news_article,news.google.com,https://news.google.com/rss/articles/CBMiqgFBVV95cUxPWlZ4anktbnhLUkQ1ajhma2lhQWhrdUgtbzVCU2pGVHA3UU9SVE5WRXMtRDhOc0psNzlCWVBCdlhIRFFwRU1TdG9US3MzalBrRlJBdkZpZWoxTkxaS0xMLVhLSXRsbjQyMzVXUlVLblBteHJXR0h4TDRJWThMSHIwWkNEbV9xOFE5OU55YmRXclYyS0IzVWNXQWVHSDR3bUE4OFhKU09MemMxUQ?oc=5,"ChatGPT's Memory Is Getting Better, Especially If You're On The Free Tier","ChatGPT's Memory Is Getting Better, Especially If You're On The Free Tier  Engadget",2026-06-04,web,False,False,google_news_rss,55,neutral
18f66fd65845afed,2026-06-05T17:10:25Z,openai,OpenAI,ChatGPT,PCWorld,news_article,news.google.com,https://news.google.com/rss/articles/CBMisgFBVV95cUxNeDdlY1JocVpwRFNvRVByTzFGY1RLUy1VMGFRMVVXa1hBTk9DVFMyX2xxRFFpTDdQMHZNR0IxNm9GOFUyUDBKR1hQM0VKLUdsSFlKTFlIb0xiNm9pOVpKeHVpbDZ3NjJMc1NTY0NxUmY0QVdSLW1aTFNMQnh3LXJJbDduUHhDTFowWjBWVFRmdGFlamZDTUJ4WHRGNmRERXNraWxveXJsbHZIQWZhektaYnBn?oc=5,ChatGPT’s new ‘dreaming’ feature makes it way better at remembering you,ChatGPT’s new ‘dreaming’ feature makes it way better at remembering you  PCWorld,2026-06-05,web,False,False,google_news_rss,55,neutral
1e26c837863de07e,2026-06-05T17:10:25Z,openai,OpenAI,ChatGPT,The New York Times,news_article,news.google.com,https://news.google.com/rss/articles/CBMinwFBVV95cUxNcWkwX1plLS1fY0JPZFc0eThwRDFVWDdKRkF0aWowOFhhQ3k0TVBKOXNiM2lMWnUtX3hjWk5TRzB1NUU0QUJDZWVTVnAwOVFDYU9ZRWh5UEtPdzRCdFVJb2xzb0piOGFDWnJvaFFDeFZtSHNnOGVpSXdiT1VLSVdhUHJWUmoxZTFQR3pVVDkwSUZDYjZpTlBxajJTal9GREU?oc=5,Can These ChatGPT Ads Make You Love A.I.?,Can These ChatGPT Ads Make You Love A.I.?  The New York Times,2026-06-04,web,False,False,google_news_rss,55,neutral
cb48e74a4421dde9,2026-06-05T17:10:25Z,openai,OpenAI,ChatGPT,CBS News,news_article,news.google.com,https://news.google.com/rss/articles/CBMiiAFBVV95cUxOcFhKZjVQVG52WXAtcUttSWJfRzU4VjRJMEEteXZOLXQxSC04S1JLaTJBVXdqS1pycmpnelNkMEJNSGFCRTZBZ3BVQ3FIS3JOWVVJMnEtSkNUeVFQVlMwUUhHdm9nSFRTX3p0V2pkcHRoZlR1N3JYRTd1Mlp6eGRzSE50RWRIUVNZ?oc=5,Mom of Auburn college student missing in Japan says they argued over ChatGPT before he disappeared,Mom of Auburn college student missing in Japan says they argued over ChatGPT before he disappeared  CBS News,2026-06-05,web,False,False,google_news_rss,55,neutral
83becd9c49c0d3c1,2026-06-05T17:10:25Z,openai,OpenAI,ChatGPT,Space Daily,news_article,news.google.com,https://news.google.com/rss/articles/CBMixwJBVV95cUxNeHlsY05admpMd1pvYkt2NDc4XzczNkR0a3dlYmN5UWxKOVItdGpyQlJNM3BZcDQyTE1QTWhUejVjZE42Tk5qck9WSUU4b3BKQzg2QXZpekVrWFNpb3NwakhHNnNmbGtOTUhlem4tTVlhYVk0SW1JTVdzZnlfemV3Qm1QLW5ZbWpPS3RsTUpUYk9WTHNfMTFjUXNGYndUSkdxNFF0djVMNDBMQ1ZDdmpTR0dqcDFQcVJsMzBacjU0ejVGT2wwMWkwd0RIdFdOOW5RaHB2U0EtSVdNWjZHTTE3UlpfTUt6c3pwbTFLckhNZFR1bnBsa3VkNDJvTU9xblRlelNBdFJYWFBBSHEzR1k2cENGOW9KODVVOUpTUkJnZW9LWXZRSzlHcnY4eXV6ajQtT0RpNlVGd0JDTkxDM2xSSEhObnVxZUU?oc=5,"Writing a single 100-word email with ChatGPT consumes approximately the volume of a standard bottle of water, the global infrastructure processing AI queries is projected to use the equivalent of half the United Kingdom's annual water withdrawal by 2027, an","Writing a single 100-word email with ChatGPT consumes approximately the volume of a standard bottle of water, the global infrastructure processing AI queries is projected to use the equivalent of half the United Kingdom's annual water withdrawal by 2027, an  Space Daily",2026-06-03,web,False,False,google_news_rss,55,neutral
8101d3d3430041af,2026-06-05T17:10:25Z,openai,OpenAI,ChatGPT,Forbes,news_article,news.google.com,https://news.google.com/rss/articles/CBMirgFBVV95cUxOc2l5ZWZMeHpiZWpkd0pPNEdfWjB4Q2Q2eVYwazF3QTd3UUdrUnY1VWFBLTBnUjN3Y3hMUF9jMVpjdmVhVkxVQ2dfMU5yZnhiNV9UNzZ3TnhhYnd6Q1liR01NLWROZVB1b3hWRFU1S3RTRHhZOEplMmlac2p0d3lIblNSc2o3TXpDSHFMM2M2NW12cFBwa2stMElaUEFlUzBYdjduRW9rMHBMbVlvRGc?oc=5,5 ChatGPT Prompts To Help You Become A Better Negotiator,5 ChatGPT Prompts To Help You Become A Better Negotiator  Forbes,2026-06-03,web,False,False,google_news_rss,55,neutral
7ee8a82e3c6c260a,2026-06-05T17:10:25Z,openai,OpenAI,ChatGPT,ADWEEK,news_article,news.google.com,https://news.google.com/rss/articles/CBMisgFBVV95cUxNd1I5RVRBWk5jZGh4ZERfdGFCenAyQ3NucHpUWjFydGZIMUotWFN1OVFzcDJEcFdqUVZkdnEzWXJDX3lBVEFEa2t2ZWV5OHA4MnFscE5lS0MyV1YzeHVHZDd3c3JTdzA5MzE4Smw5UjlabzgxN1ZZQXdydDlyalFYVVVNTzZBbFhBM2pSWWxVY3B4N0E1VWkyeFB6c3JoNnZvYklCcGJPbWNLUzdZbkVUWHRB?oc=5,"EXCLUSIVE: Criteo Cuts ChatGPT Ad Minimums, Offers Incentives to Woo Retailer Brands","EXCLUSIVE: Criteo Cuts ChatGPT Ad Minimums, Offers Incentives to Woo Retailer Brands  ADWEEK",2026-06-04,web,False,False,google_news_rss,55,neutral
64ef40c15d204021,2026-06-05T17:10:25Z,openai,OpenAI,ChatGPT,People.com,news_article,news.google.com,https://news.google.com/rss/articles/CBMiygFBVV95cUxNYU1iMzZSczlLQXhyTll0bVhnYTZ1QThZankwNFVQdnFiZ3JBWVJtZkJGRnNaM19YaFZRbEY1S1lveHhRZ1lGQmhMeFptaml2YUFkcHVHMXRRSzNFTzlxLVBKZnpxbzJGeFdsRXdFNkM0UWNWaHB0UDlRMnc4eV9hVGczQXRYdWtsNGpzV29ycjFvWWNHN3dIUS1ycEtraF9hZkpFcllFVDE0dEpId29jdE5zNHdleGFhdjFKTnBORkxNQ0tKTWd4UjNB?oc=5,Missing Auburn Student Disappeared After Arguing with His Mom Over ChatGPT,Missing Auburn Student Disappeared After Arguing with His Mom Over ChatGPT  People.com,2026-06-05,web,False,False,google_news_rss,55,neutral
ac59fadd16a8224e,2026-06-05T17:10:25Z,openai,OpenAI,ChatGPT,WSJ,news_article,news.google.com,https://news.google.com/rss/articles/CBMiiwFBVV95cUxPeXdfRkl6eW0zMTV1eTVMaXJkTElueld1YlJXUUtUY2hJdUZVWGR1b3FJTDJSZnUybjNwN3N3YmRTYmRMNFJZdjhSakdsRzdTUVZrOUd2VlFlNWxwQkExaERrUHpyeUZPQl9DQUw4M0xReS1HR2diaTFWVzhCajVyTmhjaGFjaW9GaDNz?oc=5,Estonia Is Fighting Brain Rot—With Free ChatGPT,Estonia Is Fighting Brain Rot—With Free ChatGPT  WSJ,2026-06-05,web,False,False,google_news_rss,55,neutral
a1944ef6d9505401,2026-06-05T17:10:25Z,openai,OpenAI,ChatGPT,Reuters,news_article,news.google.com,https://news.google.com/rss/articles/CBMiuAFBVV95cUxQc1N4SVoxYU44cUhoZzRTNVA4c2kxQk5NdzE0cjMzWFBIUnZZTnlDb0NjM1diQTdHY2tEaVNDeVI3bWNWOXIzQUYwQVowSUVhdEpfN0Jza3FDQk5RcmU2QmRrX1c0dnVGVkxwN0g1cXo2YzhZenJoN3N4SjNSRm83dEh4dmhjTGlLLUg0MzlTV3A2ZnVWQ0x3bl9IRW5hbll0VkRXbWxGa3AzcXAzelhLb2dFSUtaSG9H?oc=5,"ChatGPT app hits 1 billion monthly active users in record time, data shows","ChatGPT app hits 1 billion monthly active users in record time, data shows  Reuters",2026-06-02,web,False,False,google_news_rss,55,neutral
ffa92d28c72fc00f,2026-06-05T17:10:25Z,openai,OpenAI,ChatGPT,The Walrus,news_article,news.google.com,https://news.google.com/rss/articles/CBMijgFBVV95cUxOSExFNk5rZ29ucUU0cHU1U292NzJwYXYtazZfV2RrUW5mbzFTSzJHaG9wOF9EamZSUWYwaTBiQy1vU3F5Rlk3RjlmRkkzYU16V3BPN20yVlpsSUVOeFhKbml1Q09HeFpTbFlvYUZQWDByekZqRVQ0ZkZCa0VQWVc4SGg0c2dIdmwyUkpsR2x3?oc=5,ChatGPT Isn’t Just Changing How We Work. It’s Harming How We Think,ChatGPT Isn’t Just Changing How We Work. It’s Harming How We Think  The Walrus,2026-06-03,web,False,False,google_news_rss,55,neutral
8e2419d7c721b86a,2026-06-05T17:10:25Z,openai,OpenAI,ChatGPT,KevinMD.com,news_article,news.google.com,https://news.google.com/rss/articles/CBMikwFBVV95cUxNWHZvcjR4YjlJblRZNVJlMkJlYk9TVnN1UjFWRW5EYWpEZ1ZoUXFTWFVqZmJicV9GVUlDMjFzd2pyMnVzSzBOWFYwa2pUUFpKbkRVeVZMLTc0MDlyNHNwZW1LYnZnRDktVzQ4c1FiUHFTTWFPMEtpSC1uTFppUGdOOVRVcEdnRVZxazVNYS1abXZmYzg?oc=5,Why ChatGPT can’t write your residency personal statement,Why ChatGPT can’t write your residency personal statement  KevinMD.com,2026-06-05,web,False,False,google_news_rss,55,neutral
44187101da0b6bbb,2026-06-05T17:10:25Z,openai,OpenAI,ChatGPT,National Catholic Register,news_article,news.google.com,https://news.google.com/rss/articles/CBMifkFVX3lxTE4tZUFwYzh4YXdoWWFXZ1hXLWRROXJCMGREMVpDZnBkcml6aXU1QlZTbVhfd3RRVWs3TWR5UUFPaDNiQ185M3FvVVRTcTR5WFBoMEFrNi1heG5KbjlWRkZENmxlNEp5U05MU1lPdU9hSmxpSWd1UFFoeE1GVE1pZ9IBgwFBVV95cUxQMG84QlFYOHlhU3kyOGxVQ3hQOFRXVThpcW9zQmlRMklVRVpESHBib253WlpPcTRvWWI2VV9fR1J2Y09TNnRyWGRuMGQ5cWg5M0ZzZEJfY05iSG5QVXFsN1YxczRHNXdQckJPQndGSExicXBkNWxvMldaZjFYZWNqVDdscw?oc=5,What Does ChatGPT Have to Do With Slavery? ‘Magnifica Humanitas’ Highlights AI’s Hidden Exploitation,What Does ChatGPT Have to Do With Slavery? ‘Magnifica Humanitas’ Highlights AI’s Hidden Exploitation  National Catholic Register,2026-06-05,web,False,False,google_news_rss,55,neutral
ef5d75b767b21591,2026-06-05T17:10:25Z,openai,OpenAI,ChatGPT,ScienceDaily,news_article,news.google.com,https://news.google.com/rss/articles/CBMib0FVX3lxTE1GTGhkTnFBZWV2dWZORGVmVVdpQTF1YjFBR3FjR0tycHFudGpRUlFHdWpPRkgzN3JsYldnaWZzYWMtTVJWc0VLeTA0RjM0eUlRSkVVMV9XVWVPNGpsd19KYXA0ZXJsdUZ2WFNEQU4yZw?oc=5,Scientists are seriously asking if bees and ChatGPT are conscious,Scientists are seriously asking if bees and ChatGPT are conscious  ScienceDaily,2026-06-05,web,False,False,google_news_rss,55,neutral
59c2dbd5d347aaa4,2026-06-05T17:10:25Z,openai,OpenAI,ChatGPT,ZDNET,news_article,news.google.com,https://news.google.com/rss/articles/CBMiggFBVV95cUxNeWhtX2JIbGN0Y0o4V090dTFORGpPZl82UG5HSnNRNGJ0RU4tbHhaUU9jckZ6anF3RS1LMTg0enFITnZZcEF6R3JlYmRoT05vcFN4SHJnaF9TZFdEb3NxZTl1T1Nlb3JZRFJqRDVLLTBLZnVQLXVlaHYzbUtTU09JRVBB?oc=5,How to use ChatGPT: A beginner's guide to mastering OpenAI's chatbot in 2026,How to use ChatGPT: A beginner's guide to mastering OpenAI's chatbot in 2026  ZDNET,2026-06-03,web,False,False,google_news_rss,55,neutral
ccc0258272721c90,2026-06-05T17:10:25Z,openai,OpenAI,ChatGPT,YouGov,news_article,news.google.com,https://news.google.com/rss/articles/CBMisAFBVV95cUxOVGhPQnJuVFBQMkdKN3IySUQ2MWdVaXc5WG9vei1STEVDVlhTNkxiOWlVNENRODB2eUotWWdnTDZjVWdmdFJZM3dxSW4zQURNWTlhSWMtN3I2QXVPQ0h0VW1QMnBjTnQ2NW81cUplT2xnNEFmSnBleFJveW5ROG1tTV93LXpuYXVncU4ydWpDQnpuVnppWExySHYtY183MU1Zbmd6RjIxRnh1YmhXQk1GOQ?oc=5,"As OpenAI reportedly prepares an IPO, what do the public make of ChatGPT?","As OpenAI reportedly prepares an IPO, what do the public make of ChatGPT?  YouGov",2026-06-05,web,False,False,google_news_rss,55,neutral
bc18d2afaa159f82,2026-06-05T17:10:25Z,openai,OpenAI,ChatGPT,TMZ,news_article,news.google.com,https://news.google.com/rss/articles/CBMijAFBVV95cUxOQ1JBZW1kZFhRVVF3dkFpVWN1WnRsV2VTeTByVkhCV2xMazFoQU1Dc3lQNUdvZFd1cnEzY3BDdHdUNVhmQ2hja1dKNTRSMlg0R1h1TXhSQmlYMHNmS1ZDLW1IM190UndETjlxNzFobFQzTER5WENKVEZWOTJCVzlBRkRLV2hXNllVRzI2TA?oc=5,"Ashlee Jenae Asked ChatGPT Suicide-Related Questions Before Death, Police Say","Ashlee Jenae Asked ChatGPT Suicide-Related Questions Before Death, Police Say  TMZ",2026-06-05,web,False,False,google_news_rss,55,neutral
ab3dd17352e18f4e,2026-06-05T17:10:25Z,openai,OpenAI,ChatGPT,CBS News,news_article,news.google.com,https://news.google.com/rss/articles/CBMihAFBVV95cUxQbmVnQjNUUV9EUTlzRTA4SkpRVWpoR3A2aU9udWRIQU1fM29mVVY3NWJuM2RoY2ZWb3k4MHhRMjFFRkJma2ZCZWpKNzhjVkpMcXVscG0xZG04UE9ick1qeGNvd0h6cUN0Y09iOXFNSHl5dVdnUzdqVE1UaDVyOXRpQjcyOGk?oc=5,She waited for a soulmate who never showed up: ChatGPT users detail AI delusions,She waited for a soulmate who never showed up: ChatGPT users detail AI delusions  CBS News,2026-06-04,web,False,False,google_news_rss,55,neutral
c9e4cd8116e261bb,2026-06-05T17:10:28Z,openai,OpenAI,ChatGPT,PPC Land,news_article,news.google.com,https://news.google.com/rss/articles/CBMilwFBVV95cUxPS3ZfcGp0OVBSSHdkNGw0UzNJR0w5VjBHblNuUFQ4T2xPRmVFSDRMTWp2OTJRa3djczVNMmdDaTBuSHBqNUdrY20zOE82NE9XNXo2V2NmZlNDSjIxenRNdjMyVl8yRUJfV2toZ2pJcFZMMExySFZHT1cyQk1QaElLNGw2NmJPMmdqOXZ3OXJLMkQyUkRCREtj?oc=5,OpenAI's ChatGPT ads are getting conversion optimization - here's what changes,OpenAI's ChatGPT ads are getting conversion optimization - here's what changes  PPC Land,2026-05-30,web,False,False,google_news_rss,55,neutral
c253507694adcd8f,2026-06-05T17:10:49Z,github,GitHub,GitHub Copilot,Business Insider,news_article,news.google.com,https://news.google.com/rss/articles/CBMikgFBVV95cUxPTHBHXzM3UUF4b1k2ZmtiREJmZkJqRnN5WXJEUG96eHFMdUlZem9ESXYwZDFPZFBwRmJPZ202MFkwQ0dIMnBWSEs5WkNVTzRMNHdCenJfOWxLRUVUeDFtOUE3S0dLaEtJMXhvamJFUjZiRHhKYUpjUkNTOTd0TVBvT096UkFVWmVFOTRaUVh4Yk5oQQ?oc=5,GitHub Copilot users get a rude awakening as new AI pricing goes into effect,GitHub Copilot users get a rude awakening as new AI pricing goes into effect  Business Insider,2026-06-03,web,False,False,google_news_rss,55,neutral
b49b536291449673,2026-06-05T17:10:49Z,github,GitHub,GitHub Copilot,Thurrott.com,news_article,news.google.com,https://news.google.com/rss/articles/CBMijgFBVV95cUxPck9nR25ZYmM1RE9TVDltMWdPa3BFeUZLZG51MHRsVVFiZlAzTXNXMVN1T2FWcXVSUDM5OTZsc1N4SmxJRWpXVmdmbGNSalBnT0p0dzh0RzRPandBY0FpRlFKX1dRd3Y1TzFJbFB6V0hDdE9ZRF84ei1taVNZMWliWGI5Szlibk5yYnRVbHJ3?oc=5,Build 2026: Microsoft Announces GitHub Copilot App,Build 2026: Microsoft Announces GitHub Copilot App  Thurrott.com,2026-06-02,web,False,False,google_news_rss,55,neutral
a28c949283b371c3,2026-06-05T17:10:49Z,github,GitHub,GitHub Copilot,The GitHub Blog,news_article,news.google.com,https://news.google.com/rss/articles/CBMipAFBVV95cUxNMGNWU2Q0Yzh6b0QtVXRuSzl1elYtOExqQUo1dTJkYUlLZkRLNWF4ZThKN1pTWnFNWnlXYzVZTmZnNE9qVVl2Tl84Q0hwMFJlMmZLczEzQVVXdXZUT0lmTE1TX0dTV1dLRVZ6RTdBOWpndDktd2F5eGlOSkpYX3dFcWNXLThhZUpVMWtQeHg2Q0FuS2VNZ0pNWkZIOW83WENtei1xNw?oc=5,GitHub Copilot app: The agent-native desktop experience,GitHub Copilot app: The agent-native desktop experience  The GitHub Blog,2026-06-02,web,False,False,google_news_rss,55,neutral
adfa9a68839ec1f0,2026-06-05T17:10:49Z,github,GitHub,GitHub Copilot,The New Stack,news_article,news.google.com,https://news.google.com/rss/articles/CBMiYkFVX3lxTE42RENKaU5uN3VKYjQ1QUdURnoxLTBuZjhnczF6bkU3T3JGeUdTUDNTNi1vNU80WThobWJ3NmltaTBzYUF5M0d5WDJScTM4QWMzQ0tNaDkzR0xBVExfakc0ZXVR?oc=5,GitHub Copilot’s usage-based billing is live: Here’s what you need to know,GitHub Copilot’s usage-based billing is live: Here’s what you need to know  The New Stack,2026-06-02,web,False,False,google_news_rss,55,neutral
fa3494e7af388bc7,2026-06-05T17:10:49Z,github,GitHub,GitHub Copilot,Ars Technica,news_article,news.google.com,https://news.google.com/rss/articles/CBMitAFBVV95cUxNVm1kdW9PMFRRSVFhUHJjMUo1cTBYUU1INklWZFRXUzNpOEVVYk1mMW9wSmhxeHRFUzNvX3RKVDZNY0Vtd1NKNHRZZTNBNUJBVkR0MzFzZkdhb29xOGtJYkh2bDVReGI1TDZVUUFvR0JNTzRmNTVrTnFYZEpHcUoxUUJ6MmI3RW41TDVEaDFMTTE0MWVwbi1GWDZoSG5TbzBybEVpSGV4TnVNdGhhdVdycUFyWUY?oc=5,AI costs how much? GitHub Copilot users react to new usage-based pricing system.,AI costs how much? GitHub Copilot users react to new usage-based pricing system.  Ars Technica,2026-06-01,web,False,False,google_news_rss,55,neutral
b68d5d7106f85ccf,2026-06-05T17:10:49Z,github,GitHub,GitHub Copilot,The GitHub Blog,news_article,news.google.com,https://news.google.com/rss/articles/CBMirAFBVV95cUxPZEx5d09BV2dkS190M25vM1dDcTdDeUQzZUtoU082eXZ2SERjTHpjUHRPNTFLZ2d3bzFtSUNiMDloTEhsMF9raUtiUEZHSmFfLUxzTGVvWHJuV0xIaVlCN1phVHJDSGxPdnRWUWpKeW9VMVRsUjNsaGpDV3R0NUg5OThKMVNZQ05JemtIQ1ZhMG53Ym1jcEhFb1poWHE2NVhDdTZnbndRRXF4TDZj?oc=5,Cloud and local sandboxes for GitHub Copilot now in public preview,Cloud and local sandboxes for GitHub Copilot now in public preview  The GitHub Blog,2026-06-02,web,False,False,google_news_rss,55,neutral
c4231cd144a7289c,2026-06-05T17:10:49Z,github,GitHub,GitHub Copilot,The GitHub Blog,news_article,news.google.com,https://news.google.com/rss/articles/CBMirAFBVV95cUxQUWRiV2plTWZLaGtDNGNGeFdYMEZtc09Xck1rZlhGTmFQMWFQY19nSU9VMGhUZ1VDaWZ5VFRITXIyenJRcHlGMmREWWlWZl9ydXJ6emJScG1YTHlOaVNOZmdXLVBTOWpjMEgtV2ItNC1SLWptaDFVT0pJWEhNSTdTNTJxVGlScmdka1M1YTVPeTlXYW1lTktDU2ZiWWltckt2M2piRmt2VzRxaWRV?oc=5,Expanded technical preview availability for the GitHub Copilot app,Expanded technical preview availability for the GitHub Copilot app  The GitHub Blog,2026-06-02,web,False,False,google_news_rss,55,neutral
cb31e841f587ccd1,2026-06-05T17:10:52Z,github,GitHub,GitHub Copilot,The GitHub Blog,news_article,news.google.com,https://news.google.com/rss/articles/CBMiowFBVV95cUxNLWJkTFlZNWNvbmJfdC11YTFFakdkcC00V1ZBZkdMNldwWXgtVklScnBvNzg1Y1BYOVUxMGhJSXpfZ1JIT0ItX2dPVTU4YmJHNVhMMk05dzIwV196TDd0NGNyaFFHNElvOWFlb1llTkpWTzNBU0NoX1g0Mk1pQnUySDZRcjQyd3FSTk5JUG53UzRKZHR1MUtmcG11a0V6anlLcGV3?oc=5,"Fix with Copilot for failing Actions now in Pro, Pro+, and Max","Fix with Copilot for failing Actions now in Pro, Pro+, and Max  The GitHub Blog",2026-06-04,web,False,False,google_news_rss,55,neutral
093ca2986570058d,2026-06-05T17:10:52Z,github,GitHub,GitHub Copilot,GeekWire,news_article,news.google.com,https://news.google.com/rss/articles/CBMiswFBVV95cUxOZU9qZnpFc2xPZE1Ba0pQeWlHVHhSVXZZNXhXRk1fRW91dGxqWE8zZFpvYnJad245YkduQm5Ib3ctUVZNNzZKb25xcjlYTkt6WFlRNlozRkVaQlVJa0JNcTZ3ZVo5VXhGNlFObjVqZ1NJdEktcjc5YmpNVUFlM05teFVXeEJzUjU3aXZ4WkJrUWVvQklTWmk0WncxRm1GdUYxcW1IWTJzUDhORHpibGxRTE5lRQ?oc=5,"Mary Jo Foley: No Copilot ‘Super App’ at Microsoft Build, but plenty of agentic fodder","Mary Jo Foley: No Copilot ‘Super App’ at Microsoft Build, but plenty of agentic fodder  GeekWire",2026-06-02,web,False,False,google_news_rss,55,neutral
635d5684efa70c49,2026-06-05T17:10:52Z,github,GitHub,GitHub Copilot,Tom's Guide,news_article,news.google.com,https://news.google.com/rss/articles/CBMiZ0FVX3lxTE1Sd2NYRGVySE9DR1RJUGQ5c2hWT3BVVWVPWXpFNC1jbFVJNzFWMjhOWjl5VDdCYzBWVl9NeVlYM1J4Ymk5U1doYVhvd2NMbm91cGhCZkVlaGRKT1M1ZzNSUUVYN0VhSjA?oc=5,"Biggest Microsoft Build 2026 announcements — agentic AI, RTX Spark Dev Box, GitHub Copilot app, new MAI models, and more","Biggest Microsoft Build 2026 announcements — agentic AI, RTX Spark Dev Box, GitHub Copilot app, new MAI models, and more  Tom's Guide",2026-06-02,web,False,False,google_news_rss,55,neutral
736df6cf89bd4384,2026-06-05T17:10:52Z,github,GitHub,GitHub Copilot,AI News,news_article,news.google.com,https://news.google.com/rss/articles/CBMiswFBVV95cUxQVzUxREpvc1JBNlFxMFZpRFpjbVVJMWhFNFVrTWg2VUItY0lxdU8xX2lTeHBDWWhsb0FGNjBNMmh3TGVzeW4ySkUwNlZuYk1aMkQ3TDVKcVMzSk9fRDRzNDJ4LXp3UHF4RnZ1Vm5STFl4SndPd0hubE9YUkxCTVR3eFFtbVpUb1B5Nm5ESXd6ZW9kS1Y3ME5UTEtGaVkxcGFEb0g3dlpEbldoSGlLbWp0MVEzNA?oc=5,GitHub Copilot users see token-based price hikes,GitHub Copilot users see token-based price hikes  AI News,2026-06-02,web,False,False,google_news_rss,55,neutral
f351ba2278f1e23b,2026-06-05T17:10:52Z,github,GitHub,GitHub Copilot,Tom's Hardware,news_article,news.google.com,https://news.google.com/rss/articles/CBMirwJBVV95cUxNSWdIUV91dkFyZVZvRTM0UEVSZ2dNVldXN2J5a3RUazBoNFJwRVR0VEQzaW94cjFqRjMtajJ2Z1ZSVzhzMHpSV1FaVHlVcm9Ia2lxWFBoaDZYRHFPUzdzakd5NjFGQ2ctOHI1d2REbkNPdHJRS2tXSllJWEdiNHdaTjJUXzlEeVAtTjhadDFGOF9qSWhTN3RGcEh6SFp6WWs5Ylk0WU1yVUZkTzZBb2FoQ0hINnpVY1Z2Vm5NSDNTcTBCTXJIQkdKVnBJdGZFbDBJdmFRTVFUWkM4R2pWeXA5LWloeVFYcS00QlFYck5QdGZkajNiaVptUlVkbDhpNWRteldRd21RTFhXNnRJamFNNmVFd1NyTzZVU2UwNEFhWkZXNEFHLVN2MFpYSFpWam8?oc=5,Github Copilot customers report up to 100-fold price hikes — AI sticker shock bites as Microsoft switches to usage-based pricing,Github Copilot customers report up to 100-fold price hikes — AI sticker shock bites as Microsoft switches to usage-based pricing  Tom's Hardware,2026-06-03,web,False,False,google_news_rss,55,neutral
6b27ea1baca04a2a,2026-06-05T17:10:52Z,github,GitHub,GitHub Copilot,Space Daily,news_article,news.google.com,https://news.google.com/rss/articles/CBMixAJBVV95cUxNaVBhc2h2NXE0RTR0R09EaVN3cVdmdWVfLTViOFk2VGplOXh2cU1fNFpkUzMzbTZmOUtaTWRpRWN0REM3aDVVTHgtMlNkQVFTbWU1YzBhQUtLSUFoY29PVWJkUndMMkFkeGk3alh6aU96WWZ0Q1JqdS10U1dseU1LNUlqUFJUR0FRZkJrcUpMaE9GV2hYRGVxNUx3SUszRmVNMGFWZnc5UWFxSHlQa0d4dzV3aG8tektkYzRhaW0yc0UybE0xSGVxOFhNQi1ZUGh2T050TkJBVTdzQ2lwemtRc1NUejNoSklyUkdvVFpGRG1TX3B2aHRvQ3RjTS1IYldjanZyTHNqMHNyRHRwMzV0TU1RZ3F6S0dRamRZVmhWZmRmTlVrT0hTV0N2aDI5T1N3Q2s1aTEyWElEQV9xRXNBc2Z6ZTU?oc=5,"Microsoft is canceling Claude Code licenses across its Experiences + Devices division by June 30, steering thousands of engineers toward GitHub Copilot, while Uber burned through its entire 2026 AI tools budget on Claude Code and Cursor in just four mont","Microsoft is canceling Claude Code licenses across its Experiences + Devices division by June 30, steering thousands of engineers toward GitHub Copilot, while Uber burned through its entire 2026 AI tools budget on Claude Code and Cursor in just four mont  Space Daily",2026-06-02,web,False,False,google_news_rss,55,neutral
2df2f3f382b5cc44,2026-06-05T17:10:52Z,github,GitHub,GitHub Copilot,PCMag,news_article,news.google.com,https://news.google.com/rss/articles/CBMinwFBVV95cUxOTzg1LVEtRGt4d0R2ejVTT3NfLXRobUEzNUtCQ3NiVjV3Tm5ra3lOYjVsOGJpTWJIbXNGTmxqVXE0MmxGWW8xM3AtS092MjBSRV9Wc1ExSTd6bnZ2LWpUMGFwaTk4V3kySkw4aGNEWnpldnljYnlYSlRXNTU1YkhsdUpaYjNqbUF6UkdSM1ZmUVJpR25ncWtXZGZHSWg0dGs?oc=5,GitHub Copilot Costs Skyrocket As Users Are Pushed to Per-Token Billing,GitHub Copilot Costs Skyrocket As Users Are Pushed to Per-Token Billing  PCMag,2026-06-03,web,False,False,google_news_rss,55,neutral
8a287980bbfbb8c3,2026-06-05T17:10:52Z,github,GitHub,GitHub Copilot,DevOps.com,news_article,news.google.com,https://news.google.com/rss/articles/CBMiiAFBVV95cUxQc1htS2VrVWVrWTdmYnp2MFZDb2tmR2I5YTliclJpYW03NEdoNFlpaG54VzFMcHZCSk1kQy12aUtLTndSdnBnLW85dU5CMTRoU2tyOWJmQkZBQXhVOXdueG83cG1pZWVCcG9WTUZscXVFZ2FDbGJlWlMySDkySXNDVk1VMW1sYUc1?oc=5,GitHub Copilot Gets Its Own App — and Agents Are the Reason Why,GitHub Copilot Gets Its Own App — and Agents Are the Reason Why  DevOps.com,2026-06-03,web,False,False,google_news_rss,55,neutral
ea0d7ccbd273be2f,2026-06-05T17:10:52Z,github,GitHub,GitHub Copilot,The GitHub Blog,news_article,news.google.com,https://news.google.com/rss/articles/CBMilgFBVV95cUxQbzNjVU5fWGlqZmU2RzIzdmF2LW1BZ1VueXRMLS1KQmw4VnczV2lxU25sOFFpaVk3WWoyLVVoYWlUWW16Wk5Obk1ZOENUdzlXcW02MkNoTkd6QjZYRGpwem9fNUt2d04tUU14SFBhZHFNMFREQ2xoR3ZVR2pDZENpMzBQbGJKaTNma0hCRmNLaGxkMjBwRnc?oc=5,"GitHub Copilot in Visual Studio Code, May releases","GitHub Copilot in Visual Studio Code, May releases  The GitHub Blog",2026-06-03,web,False,False,google_news_rss,55,neutral
9058f22aeef0d333,2026-06-05T17:10:52Z,github,GitHub,GitHub Copilot,Microsoft,news_article,news.google.com,https://news.google.com/rss/articles/CBMihgFBVV95cUxNbldQMElLbkozZzBLb19mOWlTZE5PT3lHSHo4T2EzWTBQSmJSbnlKTnhRWEdILVFQcTZfM1BnTERzY2FXSWpSNkdVQzZ5b0VDTm15LVRuMW5FQkJKVnA1UEV0UHZTVGUyMXFaRUtDWGYxb1RBRmdneUJHdUNmMVVONTRnbmRWUQ?oc=5,Tecban increases up to 35% productivity with Microsoft 365 Copilot + GitHub Copilot,Tecban increases up to 35% productivity with Microsoft 365 Copilot + GitHub Copilot  Microsoft,2026-06-02,web,False,False,google_news_rss,55,neutral
c48f04f98a92d01c,2026-06-05T17:10:55Z,github,GitHub,GitHub Actions,eSecurity Planet,news_article,news.google.com,https://news.google.com/rss/articles/CBMiqAFBVV95cUxNV3Y2bXNhME01ZW41Ul80RTVUQUxTcjNZaldxcmxmTjhEMDl1UzlwU1ZlenBjUHdWSVlWZmVzdFVLNG8wVVVmT2xaU3AtTlppV29IQU5HVzVKOW94ZkpNTGE1Z1BwVk5vSmhCM1RwVVphYmhJVkI4M0tkdlowaEx3ckZyR1FZVTRsNW90Mk8tbldocTVDSVNqNEtWaWxCOWVaWWxyYVU5ZUw?oc=5,Claude Code GitHub Actions Flaw Created Supply Chain Attack Risk,Claude Code GitHub Actions Flaw Created Supply Chain Attack Risk  eSecurity Planet,2026-06-02,web,False,False,google_news_rss,55,neutral
a6ae1df985f108e5,2026-06-05T17:10:55Z,github,GitHub,GitHub Actions,gbhackers.com,news_article,news.google.com,https://news.google.com/rss/articles/CBMibkFVX3lxTE5xcldfQWQyTWt2amo2MFAwa3VBSzhkWGRrZHpwa1kwQU5ucWw3N0drWElmeUM0dEdJbGJ4dUY3QjRJUGtvM0htYVVDZ3lDMTJ1YnVlQjlBTHhBMldYWUpYNXVFZHE2VUFJQUxZY1JR?oc=5,38% of GitHub Actions Workflows Exposed to Script Injection Risks,38% of GitHub Actions Workflows Exposed to Script Injection Risks  gbhackers.com,2026-06-03,web,False,False,google_news_rss,55,neutral
